순서,용어명,내용
1,1차 에너지 (Primary Energy ),어떤 전환이나 변형이 이루어지지 않은 에너지이다
2,1차 에너지 순공급 (Total Primary Energy Requirement Availability ),"에너지 발란스의 주요항목으로서, 대상지역 주체의 1차에너지 순내수와 동일하다."
3,1차 에너지 총소비 (Gross Consumption ),특정지역 주체의 내수와 국제 벙커링 수요를 합한 1차에너지량 (에너지 수출입 및 재고변동 포함)을 말한다.
4,1차 에너지 투입 (Primary Energy Input ),"에너지 이용공정에서의 석탄, 석유, 가스등 1차 에너지의 소비를 말한다."
5,1차 에너지 투입기준 (Primary Energy Input Balance ),최종수요를 충족시키기위해 소요되는 모든 에너지원의 양을(화석연료 등) 특정 1차에너지의 양으로 등가전환시켜 표시하는 종합에너지발란스의 한 형태. 이러한 1차에너지로서 등가 전환은 이 발란스표에 계상되는 모든 항목에 적용된다.
6,1차에너지 총내수 (Gross Inland Consumption ),
7,2차 에너지 투입 (Primary Energy Input ),에너지 이용공정에서의 전기등 2차에너지의 소비이다.
8,2차 열매체 (Secondary Heat Transfer Fluid ),열저장시스템으로써의 또는 열저장 시스템으로부터의 열전달을 주도하는 중간 매개체이다.
9,3D 스캐너(3D Scanner),3D 스캐너란 대상물체의 형상정보를 획득 디지털화 할 수 있는 기계카메라처럼 원뿔형태의 시야를 가지고 있고 카메라가 피사체 정보를 얻는 것 처럼 3차원 정보를 취득 3차원 스캐너는 물체의 깊이 정보까지도 취득합니다. 기하학정보가 샘플링된 점군(Point Cloud)을 형성하는 것입니다.
10,"3D 프린팅(Additive Manufacturing,AM)",3차원 디지털 형상 데이터를 기반으로 2차원 단면 데이터를 생성하고 소재를 얇은 층으로 형성하여 적층 방식으로 제품을 제조하는 기술이다. 3D 프린팅의 정식 명칭은 Additive Manufacturing이다.
11,"3차원 빔 형성(Three-Dimensional Beamforming,3D-BF)",배열 안테나를 수평과 수직으로 배치하여 3차원(3D) 빔(beam)을 형성하는 기법. 3D 빔 형성 기법은 원하는 방향으로 예리한 빔을 만들어 안테나 이득은 물론 혼신을 최소화하고 수평과 수직 방향의 빔 형성이 가능하기 때문에 아파트나 고층 건물에 있는 이용자에게도 별도의 기지국 설치 없이 서비스가 가능하다.
12,"3차원 측정기(Coordinate Measuring Machine,CMM)","CMM. 이는 Coordinate Measuring Machine의 약자로 좌표측정기, 즉 3차원 측정기를 뜻한다. 3차원 측정기는 X축을 좌우 방향으로, Y축을 전후 방향으로, Z축을 상하 방향으로 하여 공작물의 치수와 형상을 측정한다. 측정은 프로브가 측정면에 직접 접촉하면서 데이터를 처리하는 것으로 이루어지며, 측정점이 많고 복잡한 형상을 측정할 때 주로 쓰인다"
13,40/100 기가비트 이더넷(40/100 Gigabit Ethernet),"이더넷상에서초당40 또는100 기가비트의 데이터속도를 제공하는미국전기전자학회(IEEE) 이더넷규격(IEEE 802.3ba-2010).서비스거리에 따라 수미터를 지원하는40G/100GBASE-CR4, 40G/100GBASE-KR4, 100GBASE-KP4, 수백미터를 지원하는40G/10GBASE-SR4, 100GBASE-SR10, 10 킬로미터(km)를 지원하는40G/100GBASE-LR4, 40 킬로미터를 지원하는40G/100GBASE-ER4 등 다양한 규격이 존재한다. 주로40 GbE는4 채널×10 기가비피에스(Gbps), 100 GbE는4채널×25Gbps 형태로 데이터를 전송한다. 전송거리가 늘면서 근거리통신망(LAN: Local Area Network)은 물론 도시권통신망(MAN: Metropolitan Area Network), 광역통신망(WAN: Wide Area Network) 및 무선가입자망으로 영역이 확장되고산업, 항공, 자동차, 국방, 방송 등 다양한 분야에 적용되고 있다."
14,"A/H입구가스온도(A/H入口가스溫度, Entering Gas Temperature)",공기예열기 입구의 연소가스 온도를 말하며 보일러에서 연료의 연소로 발생된 가스가 작동유체(물 또는 공기)에 열을 전달한 후 배기과정에서 연소용 공기를 예열하기 위하여 공기예열기에 들어갈 때의 가스온도이다. 입구가스온도의 변화에 공기예열기 출구가스 온도는 공기예열기 온도효율에 비례하여 변화하며 입구가스가 저하될수록 배기가스의 보유열량이 저하되므로 보일러 효율은 상승된다.
15,"A/H입구공기온도(A/H入口空氣溫度, Entering Air Temperature)",공기예열기 입구온도를 말하며 증기식 공기예열기를 사용하는 보일러에서는 증기식 공기예열기 출구공기의 온도를 말함. 일반적으로 입구공기온도가 변화하면 출구가스 온도는 공기예열기의 온도효율에 비례하여 변화하므로 입구공기의 온도가 높을수록 보일러 효율은 상승하는 효과가 있다.
16,API Number,"원유나 석유제품의 비중을 나타내기 위한 지표로서, 미국석유협회(API : American Petroleum Institute)가 제정한 화학적 석유비중 표시방법. 일반적으로 탄화수소가 많을수록 비중이 커지는데, 보통 API 34도 이상의 원유를 경질원유, API 30-34도의 원유를 중질원유, API 30도 이하의 원유를 중질원유로 분류함."
17,"Advanced Encryption Standard,AES","미국 표준 블록 암호였던 DES의 안전성에 문제가 제기됨에 따라 2000년 새로운 미국 표준 블록 암호로 채택된 128비트 블록 암호이다. 이 알고리즘은 128/192/256 비트 키 길이를 제공하고, 라운드 수는 키 길이에 따라 각각 10, 12, 14이다. AES는 미국 표준 블록 암호라는 이름에 걸맞게 전세계 암호 학자들로부터 많은 관심을 받고 있다."
18,"Application Programming Interface,API",다른 시스템이나 소프트웨어들이 서로 명령과 결과를 주고받을 수 있도록 상대방의 형식에 맞게 변형시켜주는 일종의 소프트웨어들 사이의 통역 프로그램
19,BOT (Build Own Transfer),"민간사업자가 사회간접설비의 일부를 설계, 소요자금조달, 건설하고 약정기간 동안 운영 및 (전력) 판매를 통하여 투자 원리금과 일정 수익을 확보한 후 공공부문에 소유권을 이양하는 사업형태로, 통상 Take or Pay 계약을 체결하여 판매시장을 확보하며, 투자의 타당성 여부는 미래의 현금수익의 흐름에 의존하게 된다. 따라서 일정기간의 사업을 보장하는 진출국의 양허협정과 장기적 수입을 보장하는 장기전력수급계약이 필요하다.한편, BOT와 BOO의 차이점은 사업 및 운영이 허가된 계약기간이 만료된 후 사업상 권리 및 잔여 재산의 소유권을 사업승인국가에 양도하느냐아니면 사업권자가 계속 갖느냐의 차이이다."
20,"Balance of Plant ,BOP","연료전지의 코어설비인 스택(stack) 이외의 주변에 있는 동력시스템 패키지를 구성하는 보조 장치(열관리시스템, 물관리시스템, 공기공급장치 등)"
21,"Battery to Grid,B2G","전기자동차의 1/3에 해당하는 배터리 가격부담을 덜고, 배터리 수명과 충전에 대한 불안감을 해소하기 위한 전기차 배터리 리스사업의 일환"
22,"Binder Jetting,BJ",3D 프린팅의 방식 중 하나로 노즐을 통해 액체 형태의 잉크가 경화물질에 분사/증착되어 화학 반응에 의해 적층되는 방식이다.
23,"Biomass-Solid Refuse Fuel ,Bio-SRF","폐지류, 농업폐기물(쌀겨, 옥수수대 등 농작물의 부산물), 폐목재류, 식물성잔재류, 초본류 폐기물을 혼합하여 제조한 바이오 고형연료 제품"
24,"Booster Air Compressor ,BAC",IGCC MAC(Main Air Compressor) 후단에서 설치되어 공기정화계통에서 정화된 공기를 재압축하는 압축기로 주로 생성가스의 압축 방식이 내부승압 방식인 경우 사용된다.
25,Brim,3D 프린팅 관련 물체가 제작판에 좀 더 잘 붙도록 하기 위해 첫번째 층을 약간 두겁하는데 이 추가적 두께를 말한다
26,"British Thermal Unit,BTU",열량을 나타내는 단위의 하나로 1BTU=252cal
27,"B종절연 (B種 絶緣, Class B Insulation)","최고허용온도 130℃에 충분히 견딜 수 있는 재료로 구성된 절연. 마이카, 석면, 유리 섬유 등을 접착재료와 함께 사용한 것이다."
28,C40 세계 도시 기후 정상회의,"전 세계 온실가스 배출량 중 80% 내외를 차지하는 대도시들이 전 세계 기후변화에 공동 대응하며, 온실가스 감축의 구체적인 방안 마련을 목적으로 결성. 2005년 런던에서 18개 대도시 모임으로 시작됐으며 2009년 서울에서 3회째 정상회의가 열림. 회의는 2년마다 개최됨."
29,"CA열전대 (CA熱傳帶, CA Thermocouple)",+극에 크로멜(니켈과 크롬의 합금)과 -극에 알루멜(알루미늄과 니켈망간의 합금)으로 구성된 열전대로 K TYPE이라 한다. 상용한도는 1000℃까지이며 기전력이 높고 값이 싸므로 많이 사용된다.
30,"CCD 카메라(charge-coupled device camera,CCD camera)","디지털 카메라의 하나로, 전하 결합 소자(CCD)를 사용하여 영상을 전기 신호로 변환함으로써 디지털 데이터로 플래시 메모리 등의 기억 매체에 저장하는 장치. CMOS형 카메라보다는 화질이 우수하나 전력 소모와 가격 면에서 불리하다."
31,"CC열전대 (CC熱傳帶, CC Thermocouple)",+극에 구리(CU)-극에 콘스탄탄(동니켈의 합금)으로 구성된 열전대 T TYPE이라 한다. 상용한도는 300℃까지이며 기전력이 안정되고 직선성에 있으며 비교적 저온 측정에 이용된다.
32,"CGS단위 (CGS單位, Centimeter-Gram-Second Unit)","미터법의 절대단위이며 길이에 cm, 질량에 g, 시간에 sec를 기준단위로 하는 절대 단위계이다."
33,"CMOS 이미지 센서(CMOS image sensor,CIS)","상보성 금속 산화물 반도체(CMOS) 구조를 가진 저소비 전력형의 촬상 소자. 전하 결합 소자(CCD)에 비해 약 10분의 1의 소비 전력, 3.3V 단일 전원, 주변 회로와의 일체화도 가능하다. CCD보다 감도는 떨어지지만 최근에는 화질이 많이 개선되어 휴대 전화는 물론 고해상도 디지털 카메라나 자동차 후방 감시 카메라 등에도 광범위하게 사용되고 있다"
34,CO2 광물화 기술,칼슘이나 마그네슘이 포함된 천연광물 또는 산업체에서 배출되는 각종 폐기물과 CO2를 반영시켜 탄산칼슘이나 탄산마그네슘 형태로 안정하게 고정화시키는 기술
35,CO2 연료화 기술,이산화탄소와 물의 역수성가스화반응을 통하여 합성가스를 생산하는 등 이산화탄소를 활용하여 연료를 생산하는 기술의 총칭
36,CO2 천층 지중저장기술,CO2 포집 이후 압축 수송하여 해양 천층 퇴적층에 저장하고 유지관리하는 기술
37,CO2 해양저장기술,이산화탄소를 석회석 또는 생석회와 반응을 통해 안정한 중탄산이온(HCO3-)으로 변환하여 심해에 장지적으로 저장
38,CPC형 집열기(Compound Parabolic Collector ),PTC형 집열형태를 가진 모듈을 여러개 합쳐놓은 형태의 집열기로 300℃이하의 중온용 집열 시스템에 사용
39,Cenosphere,Fly Ash 중 내부가 CO2나 N2 가스로 채워져 수면에 부유하는 물체로 무게는 가볍고 발생량은 Fly Ash 전 중량의 약 5% 정도 발생되고 입격은 20~30um 정도임
40,"ConocoPhillips,CoP",미국의 종합 에너지회사로 2단 가스화 기술인 E-GasTM의 특허 소유
41,"Cost, Insurance and Freight,CIF","수출입 상품의 비용 및 선적시부터 도착시 까지의 운임, 보험료를 포함한 가격을 말하며 공급자가 운임, 보험료를 전부 부담하는 무역거래 조건의 하나."
42,"C접점/절체접점 (C 接點/絶體接點, Changer-Over Contact(C-Contact))",서로 공통된 접점단자를 갖는 A접점/B접점을 일괄하여 C접점이라 한다. 동작시에는 먼저 Break 접점이 Open하고 이어서 Make 접점이 Close하는 계전기나 전원 등의 접점 조합을 말한다.
43,"C종절연 (C種 絶緣, Class-C Insulation)","허용최고온도 180℃ 초과 온도에 충분히 견딜 수 있는 재료로 구성된 절연. 마이카, 석면, 자기 등을 단독으로 사용한 것 또는 접착 재료와 함께 사용한 것을 말한다."
44,"DLL 파일(Dynamic linking library,DLL)","OS/2, 윈도즈 등의 운영 체계(OS) 본래 기능으로 소프트웨어의 루틴을 몇 개의 파일로 나누어 디스크에 두고 필요한 것만을 실형 메모리에 실어서 사용하기 위한 파일. DLL로 사용되는 파일은 확장자가 ‘dll’로 되어 있기 때문에 ‘DLL 파일’이라고 부른다. DLL의 장점은 루틴을 공통으로 사용하는 것이다. 루틴의 함수 집단을 자료집(library)이라 하는데, 보통 실행 파일을 작성할 때 자료집을 포함해서 컴파일하는 경우가 많다. 그러나 이 방법은 동일 루틴을 다수의 실행 파일이 갖는 것으로 되어 비효율적이다. DLL은 다수의 실행 파일에 공유될 수 있기 때문에 디스크 용량이나 메모리를 절약할 수 있다. 또 프로그램을 수정하려는 경우, DLL 파일만을 수정함으로써 완료되는 경우도 있다. 윈도즈 등에서는 OS 기능은 물론 DLL을 애플리케이션과 공유할 수도 있으며, DLL 파일 등의 애플리케이션이 공유되고 있는 것은 이용이자 수준에서 판단하기는 어렵다."
45,DLN,저 Nox 연소기로 예혼합 연소 방식이다. 신형 가스터빈의 경우 15% O2 조건에서 Nox 15 혹은 25ppm 이하의 배출량을 만족한다.
46,"Di-Methyl-Ether,DME","천연가스로부터 출발하여 얻어지는 화합물로서 디메틸 설페이트, 고가의 산소결합 화합물 등의 중요한 화학제품을 제조하는데 중간체로 사용되어 왔으나 최근의 DME의 환경친화적 성질로 인하여 오존층 파괴의 주범인 CFC를 대체하여 헤어스프레이, 면도크림 등의 에어로졸 분사제로서 사용되고 있음. 지금까지 DME의 사용량은 그리 대단한 것은 아니었으나 최근에 DME가 디젤엔진의 대체 청정연료로 사용이 가능하다는 것이 알려지면서 가까운 미래에 DME가 청정연료로서 크게 활용될 것으로 예측됨."
47,"Dimethyl ether,DME","가장 간단한 지방족 에테르류. 메틸에테르라고도 하며 분자식은 C2H6O. 일반적으로 메탄올이 탈수반응을 거쳐 생성되지만, 석탄에서 얻어지는 합성가스와 천연가스로부터 DME 생산이 가능. 최근 수송 에너지로서 각광을 받고 있는데, 특히 수송 연료의 관점에서 DME 활용은 기존의 가솔린과 디젤 연료에 비해 질소산화물과 미탄화수소의 배출가스가 현저히 낮게 배출되어 새로운 ULEV (Ultra Low Emission Vehicle)의 환경 규제치를 만족할 수 있기 때문에 청정 에너지중의 하나로 거론되고 있음"
48,"Dry Solids Removal or Flyash Removal,DSR",합성가스 중의 Ash 성분을 제거하기 위한 설비로 Ceramic Filter 및 제거된 Ash를 배출하기 위한 Lock Hopper 및 Sluicing System으로 구성된다. 고온가스 냉각기 출구가스는 고압·고온필터를 거쳐 잔류 Ash 성분 및 할로겐족 화합물 제거를 위해 Wet Scrubber로 공급된다.
49,ESS 배터리 (Energy Storage System Battery ),"에너지밀도와 효율이 높고 국내 대기업이 경쟁력을 갖고 있는 리튬이온 전지가 대표적이며 이밖에도 레독스 흐름 전지(RFB), 나트륨황 전지(NaS) 등이 개발되고 있다."
50,ETA (Event Tree Analysis),"안전분석방법의 하나. 사고의 발단이 되는 사상(事象)을 초기사상이라고 한다. 이에 관련된 기계설비의 각 부분이나 작업공정의 각 단체에서 안전기능이 어떻게 후속하고 일련의 기능에 영향을 주는가에 착안하여 전후의 순서를 정하고, 그 기능(예컨대 작동, 연속운전, 전환, 이상으로부터의 회복 등)을 성공과 실패로 나누어 수목상(樹木狀)으로 전개하여 각가지의 발생확률을 정함으로써 발생위험이 있는 사고, 재해의 종류와 그 발생확률을 구하는 것이다. FTA(Fault Tree Analysis)가 결과로서의 사고, 재해를 상정해서 거기서부터 원인과 요인을 추구해가는데 대하여 분석의 방향이 반대이며, 이로서 처음에는 상정할 수 없었던 형태의 재래도 척출할 수 있다. FMEA(Failure Mode and Effect Analysis)는 방향은 같지만 고장모드(Failure Mode)에서 바로 그 영향(결과)으로 옮겨지는데 대하여 ETA는 초기사상인 고장모드에서 사고, 재해로 발전해 가는 과정이다. 시퀸스(Sequence)에 초점을 맞추고 있는데 특징이 있다. 복잡한 시스템에서 중대재해가 발생할 우려가 있는 것에 대하여는 ETA와 FTA의 분석을 병행할 필요가 있다."
51,"Equipment Data/Requisition Sheet,EDRS",각 기기별 기술규격서 작성 또는 구매를 위해 기기별 주요 사양을 명시한 양식
52,"Equipment Design Case,EDC",가스화기 단위 기기 설계시 고려되어져야 하는 조건으로 저품질의 석탄을 100% 부하에서 운전되는 조건
53,"E종절연 (E種絶緣, Class E Insulation)",최고 허용온도 120℃ 에 충분히 견딜 수 있는 재료로 구성된 절연을 말한다.
54,FMEA (Failure Mode And Effect Analysis),"고장모드(Mode)와 영향분석이라고 한다. 기계, 설비, 시스템 등의 신뢰성의 문제점을 설계의 단계에서 안전을 예측하는 방법이다. 기계, 설비, 시스템 등을 구성하는 각각의 구성요소에 대해서 일어날 수 있는 모든 고장이나 재해의 형태를 상정하여 그 원인을 추정하고 그것이 기계, 설비, 시스템 그리고 인간에 대하여 미치는 영향을 검토하여 표형식을 사용해서 계통적으로 해석하는 방법이다. 최종적으로는 이러한 검토결과에서 치명적인 영향을 미치는 것을 검출해서 일람표를 작성하여 설계심사, 설계변경 등의 자료로 사용한다. 작성하는데는 각각의 구성요소의 전문적인 지식과 경험을 필요로 하며, 각 전문분야의 기술자 그룹에 의해서 실시된다. 또한 전자계부품처럼 고장율이 알려져 있는 것에 대해서는 정량적인 비교평가를 하기 위한 치명도해석(CA)을 실시할 수 있다. 이 방법을 FMECA(Falure Mode Effect and Criticality Analysis)라고 한다."
55,FTA (Fault Tree Analysis),"결함관련수법이라고도 한다. 고장 또는 재해가 일어났을 경우 그것이 어떠한 결함에 의해서 초래되었는가를 순차적으로 파내려가는 방법으로서 하나의 결함이 몇 가지의 결함에 의해서 야기되기 때문에 이 방식으로 분석을 해나가면 최종적으로 나무와 같은 그림으로 되기 때문에 이와 같이 불리운다. 기계, 설비, 시스템 등에 대해서 고장이나 재해의 발생요인을 약속된 기호에 의하여 논리적 형식으로 해석하는 방법이다. 발생요인을 추구하려고 하는 고장이나 재해를 주제로 하여 발생하기 쉬운 원인과 조건을 상부의 레벨에서부터 하부의 레벨로 향해서 나뭇가지가 뻗듯이 차례로 검토하여 논리도 형식으로 표현한다. 원인과 조건에 대해서는 기계, 설비, 시스템 등의 구성 요소의 결함, 인간의 미스, 소프트웨어의 트러블, 환경조건의 영향 등을 표현할 수 있다. 또한 최종적인 원인과 조건의 발생확률이 전부 구해지는 경우에는 그 고장 또는 재해가 발생하는 확률을 구할 수 있다."
56,"Feed & Effluent Heat Exchanger,FEHX","열교환기란 어떤 유체가 가지고 있는 열에너지를 전도, 대류 및 복사의 열전달 원리를 이용하여 다른 유체에 전달할 수 있도록 제작 설치한 열교환 장치이며, FEHX는 어떤 Unit으로 공급 및 배출되는 유체를 상호 열교환하여 냉각 및 가열하는 장치"
57,"Fisher Tropsh,F-T","석탄으로부터 제조된 합성가스를 이용하여 액체 연료물질을 제조하는 공정(CTL, Coal to Liquid)으로 1925년 독일의 Fischer 와 Tropsh에 의해 처음 특허로 등록된 합성석유의 제조를 들 수 있으며, 1930년부터 상용화되어 개발자의 이름을 따서 Fisher-Tropsh(F-T) 공정이라 명명되었다. 이 공정을 통해 얻어진 합성유는 upgrading 공정을 통하여 자동차 연료인 디젤유, 가솔린 또는 왁스 등을 제조하였으며, 2차 세계대전시 독일에서는 총 27개 공장에서 연 400만톤의 연료를 생산하였으며, 1950년 후반부터 남아공의 Sasol사에서 상용화하여 현재까지 일일 15만 배럴의 연료를 생산하고 있다."
58,Fuel Gas Compresser,한국가스공사에서 공급하는 가스망의 압력과 최신 가스터빈의 입구 요구 압력차에 의해 압력을 상승시켜줄 필요가 있어 설치되는 설비. 회전하는 임펠러에 의하여 기체에 원심력을 주고 이것을 이용하여 압축을 작용한다. 기체에 압력을 부여하기 위해 압축부와 회전력의 전달을 위한 구동부 그리고 구동부의 원활한 운동을 위하여 오일을 공급하는 윤활부로 이루어져 있다.
59,"Gasifier Membrane Wall,GMW",가스화기 내부의 1500℃ 이상의 생성가스의 열손실을 방지하기 위하여 가스화기 외벽에 수관형식의 Membrane Wall이 설치되어 Tube로 급수가 흐르면서 증기를 생산한다. 공급 급수압력은 가스화기의 건전성을 위하여 가스화기 운전압력보다 약 10 kg/cm2 이상으로 운전되어야 한다.
60,Guard Bed,촉매를 이용한 주 반응기(MainReactor)로 합성가스를 유입시키기 전 합성가스 내에 포함되어 있는 dust 성분을 제거하기 위한 장치. 이는 dust를 통한 주 반응기의 촉매 pore를 막아 활성이 저하되는 것을 방지하여 안정적인 운전이 되도록 도와주는 역할을 한다.
61,HCN/COS 가수분해 설비(HCN/COS Hydrolysis Unit),Syngas내에 포함된 HCN 및 COS 성분을 촉매반응을 통하여 후단공정인 AGR에서 처리가 용이한 성분으로 가수분해하기 위한 계통이다. HCN 가수분해 촉매는 AGR 공정의 Solvent(용매)의 Degradation을 방지하기 위하여 HCN을 NH3로 가수분해하는 역할을 수행한다. COS 가수분해 촉매는 Gas Turbine 입구에서 요구되는 Total Sulfur의 농도 및 대기로의 SOx 배출을 최소화하기 위하여 COS를 AGR에서 흡수율이 더 높은 H2S 로 가수분해하는 역할을 수행한다.
62,"Heat Stable Salts,HSS","AGR 공정에서 용매로 사용되는 Amine을 더 이상 열을 가해도 재생이 되지 않는 안정적인 상태의 화합물을 의미한다. 이는 산성가스 속에 포함된 산성물질(중화제)과의 반응을 통하여 생성된다. formate, acetate, thiosulfate, thiocyanate, chloride 등과 같은 산성을 띠는 화합물의 경우 Amine과 반응하여 HSS를 생성한다."
63,Hepa Filter,High-efficiency particulate arrestance ( HEPA )는 고효율 미립자 체포 또는 고효율 미립자 공기의 형태인 에어 필터이고 무작위 배치된 섬유 매트이다. 섬유는 일반적으로 구성되는 유리 섬유 는 0.5 및 2.0 사이의 직경을 가지고 있다. MHI의 에어필터의 경우 Double Layer로 되어 있고 97%의 효율을 갖는다.
64,I-S선도/모리에선도 (Mollier Diagram/Mollier Chart/I-S Diagram),"물, 암모니아 프레온 등의 증기의 열적상태를 쉽게 알 수 있게 여러가지 온도, 압력, 건조도 등에 따라 그 증기의 압력, 온도, 엔탈피, 엔트로피, 비체적 등을 표시한 선도이다. 종축에 엔탈피를 횡축에 엔트로피를 기준좌표로 취하고 각 상태에서의 증기의 온도, 압력 및 비체적과 포화증기의 건도를 선으로 연결하여 도시한 증기선도로 1904년 독일의 모리에교수의 제안에 의해 작성되었으므로 Mollier 선도라고도 한다. 단열변화가 수직선으로 표시되어 팽창과정에서의 열량을 선도상 수직거리로 나타낸다."
