순서,용어명,내용
3673,"정전용량 (靜電容量, Electrostatic Capacity)","교류회로에서 전기의 흐름을 방해하는 전기적 특성의 일종을 말한다. 직류에서는 전기의 흐름을 방해하는 것은 저항뿐이나, 교류회로에서는 저항뿐만 아니라 인덕턴스와 정전용량이라는 특성도 전기의 흐름을 방해한다. 정전용량은 커패시턴스(Capacitance)라고도 하는데, 그 특성이 나타나는 위치에 따라 대지정전용량, 적용정전용량, 선간정전용량 등으로 나눌 수 있다. 두 전극 사이의 정전 용량은 두 전극에 각각 정부의 전하 Q를 주었을 때 이 전극 사이의 전위차가 V인 경우 C = Q/V = εA/t(단,A는 극판의 면적, ε은 극판간의 물질의 비유전율)로 나타낸다. 1V의 전위를 가하였을 때 1C의 전하가 저장되는 정전용량을 1패럿이라 하며 1F로 표시한다."
3674,정점 부하 소비 (Peak load consumption ),연결망에 있어서 수요가 정점에 달했을 때의 에너지 소비.
3675,정제(Cleaning),석탄의 광물질(회분) 함량을 줄이기 위한 처리. 석탄의 정제과정에서 원료물질은 그들이 갖는 물리적 혹은 물리화학적 특성에 따라 (기본)성분별로 분리된다.
3676,"정제상태 (정제狀態, Stagnation State)",유체가 유동되는 도중 물체를 만날 때 물체의 선단에서 유동이 순간적으로 정지되어 유체가 단열(등엔트로피)적으로 압축되는 현상을 정체(Stagnation)라 하며 정체현상이 발생하는 점을 정체점이라 하고 이때의 유동상태를 정체상태라 한다.
3677,정제연료유,폐유를 정제하여 제조한 연료
3678,"정지 (停止, Halt)","1.마이크로컴퓨터의 작동을 중지시키기 위한 명령. 이 명령에 의해 중앙처리장치가 정지된다.2.정지명령, 예기치 않은 상황, 인터럽트 등에 의해 프로그램의 실행이 일시적으로 멈추는 상태. 인터럽트 등에 의해 프로그램의 실행이 일시적으로 멈추는 상태이다."
3679,"정지블레이드가변제어 (停止블레이드可變制御, Sta- tor Blade Control)",축류송풍기 및 압축기에서 가변정지 블레이드로 압력 또는 가스량을 제어하는 것이다.
3680,"정지수위 (停止水位, Stopping Water Level)",자동 운전시 펌프가 정지되는 수위이다.
3681,"정지형기동장치 (停止刑起動裝置, Static Starting Device (SSD))","가스터빈 기동장치의 일종으로 가스터빈 기동시 발전기의 회전자에 직류전원을 공급하고, 고정자에는 가변주파수를 갖는 교류전원을 공급하여 발전기를 전동기화하여 같은 축에 연결된 가스터빈을 기동 및 가속시켜 설정된 속도까지 운전을 수행토록 설치된 기기. SFC(StaticFrequencyConverter)라고도 하며 안양복합과 분당복합의 가스터빈에 이형식이 채용되었다."
3682,정책성 전원 (政策性 電源),"발전소를 건설하거나 계획을 수립함에 있어서 경제적 타당성은 미흡하지만, 전력수급 안정측면 또는 정부 정책상 발전소 건설이 필요한 설비를 정책성 전원설비라고 하며, 우리나라는 국내탄, 대체에너지, 양수, 분산형전원 발전소 등을 보통 정책성 전원이라고 말한다."
3683,"정출력운전 (定出力運轉, Output Constant Opera- tion)",주위의 상태와 관계없이 출력을 일정하게 유지하도록 제어하여 운전하는 것이다.
3684,"정치용가스터빈 (定置用가스터빈, Stationary Gas Turbine)",이동용이 아닌 일정한 지점에 고정하여 가동하는 가스터빈이다.
3685,"정태안정도 (定態安定度, Steady-State Stability/ Static Stability)",부하를 서서히 증가 하였을 때 어떤 범위까지 안정된 운전을 할 수 있는가의 정도를 말함. 정상적인 부하변동 조건에서 병열운전중인 발전기들 상호간에 동기를 유지하면서 계속 운전할 수 있는가를 나타내는 계통 특성을 의미한다.
3686,"정태안정도 (靜態安定度, Small Signal Stability)","정태안정도는 전력계통에서 완만한 부하변화 등과 같은 미소외란(微小外亂)이 발생했을 때 저주파 진동과 같은 불안정 현상이 발생하지 않고 지속적으로 계통을 운용할 수 있는 정도를 말하며, 미소신호안정도라고도 불린다. 전력계통에서의 안정도는 계통에 연결되어있는 동기기(同期機; 대부분의 발전기)가 외란이 발생한 이후 안정되게 동기(同期) 운전을 할 수 있는 정도(程度)를 말하는데, 전력계통에 가해지는 외란의 크기에 따라 과도안정도와 정태안정도로 분류하고 있다."
3687,"정특성 (靜特性, Static Characteristic)",어떤 회로 또는 장치의 정상상태에서 입력과 출력과의 관계를 나타내는 특성이다.
3688,"정한시계전기 (定限時繼電器, Definite Time Limit Relay)",계전기가 동작입력의 크기에 관계없이 계전기 동작치 이상의 입력이 들어오면 항상 미리 조정된 일정한 시간에 동작하는 계전기이다.
3689,정형 데이터(Structured Data),말 그대로 정형화 되어있는 데이터를 뜻합니다. 우리가 흔히 알고 있는 Excel에 들어가있는 데이터를 정형 데이터라고 생각하시면 됩니다.
3690,"정확도 (正確度, Accuracy)","오차의 대소정도 즉 정확성을 의미하는 것으로서 양적으로는 오차의 절대치를 정확도라 하고 이의 계측치에 대한 비를 정확율(Accuracy Fa- ctor)이라고 한다. 전자를 절대정확도(Absolute Accuracy), 후자를 비정확도(Specific Accura- cy)라고 칭하기도 한다."
3691,"정확도 (精確度, Accuracy)","계기, 지시값과 허용 표준값(Accepted Stan- dard) 또는 참값(True Value)과의 일치성(Co-nformity). 정확도는 참값과 계기 지시값의 차이(오차)를 계기전측정범위(Guage Span)에 대한 백분율로 표시하며, 정확도는 측정방법, 측정자, 측정기구, 환경 등의 영향을 받는다. 정확도 오차에는 히스테리시스 및 반복도(Repeatability) 오차가 포함되나 마찰 오차(Friction Error)는 포함되지 않으며, 정확도는 특정 조건하에서 결정된다."
3692,"정확도(正確度,Accurary)","정확도(正確度, accuracy)는 과학, 산업, 공업, 통계학 분야에서 재거나 계산된 양이 실제값과 얼만큼 가까운지를 나타내는 기준이며, 관측의 정교성이나 균질성과는 무관하다. 정확도와 밀접한 관계가 있는 정밀도(精密度, precision)는 여러 번 측정하거나 계산하여 그 결과가 서로 얼만큼 가까운지를 나타내는 기준이며, 재현성이라고도 한다. 관측의 균질성을 나타내며, 관측된 값의 편차가 적을수록 정밀하다. 정밀도는 관측 과정과 우연 오차와 밀접한 관계를 가지며, 관측장비와 관측방법에 크게 영향을 받는다."
3693,정회원 (正會員),"전력거래소를 통해 전력을 거래할 수 있는 회원을 말하며 정회원의 자격은 전력시장에서 전력거래를 하는 발전사업자 및 자가용발전설비 설치자, 판매사업자, 전력시장에서 전력을 직접 구매하고자 하는 전기사용자 등이다."
3694,"제2차 페일세이프 시스템 (第2次 페일세이프 시스템, Secondary Fail-safe System)","페일세이프란 고장이나 실수에 대비한 안전조치를 뜻한다. 순수한 페일세이프 시스템에서는 조금 벗어나지만 이에 준하는 것이라는 데서 이같이 불리운다. 이에 속하는 것으로는 작업자 자신이 몸을 방호하기 위해 착용하는 각종의 보호구가 있다. 기계, 장치를 사용하지 않는 작업에서는 대상물을 페일세이프로 할 수 없으므로 인간쪽을 방호하는 이외에는 대책이 없다는 데서 사용된다."
3695,제게르콘 (Seger Cone),"독일인 제겔의 착안으로 도자기류 제품의 소성온도, 내화도 등을 시험하기 위해 만든 삼각뿔이며 성분의 배합에 따라 연화 융해하는 온도가 정해진다."
3696,제너다이오드 (Zener Diode),"제너 항복을 이용한 정전압 소자로서, 정전압 다이오드와 전압 표준 다이오드의 두가지가 있다. 전자는 정전압 동작을 목적으로 한 실리콘 집합 다이오드로서 전압은 3∼150V, 전력은 200㎽∼50W의 범위로 사용된다. 후자는 정전압 다이오드에서 제너 전압의 온도 변화율을 매우 작게 한 것으로서, 보통 2∼3개를 직렬 접속하여 카드뮴 표준 전지 대신 전압 표준으로 사용된다."
3697,"제너효과 (제너 效果, Zener Effect)","PN접합에 큰 역전계가 가해졌을 때, 이 전계에 의해 변동 영역에서 P형의 가전자대에 있는 전자가 터널 효과에 의해 금지대를 통과하여 N형의 전도대로 이동될 확률이 커지며 그 결과 급격한 전류 증가가 생기는 현상이다."
3698,제네바 기후협약,"기상이변, 사막화, 해수면상승 등을 유발하는 지구온난화 현상을 방지하기 위해 1992년 6월 리우 유엔환경개발회의에서 채택, 1994년 2월21일 정식 발효되었으며 ‘온난화방지협약’이라고도 함. 원제는 ''''기후변화에 관한 기본협약''''이며, 이 협약은 각국의 의무사항, 재정지원, 조직사항 등을 포함하고 있음. 특히 프레온가스(CFC)를 제외한 모든 온실가스 배출 억제를 위한 협약으로 의무사항은 선진국과 개도국에 공통으로 적용되는 일반 의무사항과 선진국 및 동유럽 국가들에 부가적으로 적용되는 특별 의무사항으로 구분됨. 우리나라는 1993년 47번째로 가입"
3699,"제동권선 (制動捲線, Damping Winding/ Amor- tisseur Winding)",동기발전기에서 회전속도의 주기적 변화를 방지하고 일정한 속도를 유지하기 위하여 설치된 권선. 제동권선은 그 구조상 전기자의 3상권선에서 보면 농형유도 전동기의 2차권 선으로 작용함. 회전자가 동기속도에서 이탈하여 고속도로 된 경우에는 제동권선이 전기자반작용 자속을 끊으므로 전류가 흘러 이 전류와 반작용자속 사이에 제동토크가 생겨 그 회전속도를 저하시키고 저속도로 된 경우에는 그 회전속도를 상승시키도록 작용하여 회전속도의 주기적인 변화를 방지한다.
3700,"제동력 (制動力, Damping Force)",진동 또는 운동을 감쇄 또는 제지시키려는 힘을 말하며 제어계통 극점이 S =-α+jw 일때 실수인 알파가 클수록 힘은 커지게 된다.
3701,"제약급전계획 (制約給電計劃, Constrained Disp-atch Schedule)","매 급전주기마다 각 중앙급전발전기 및 중앙급전부하의 송전접속점에서의 출력 및 주파수제어 보조서비스의 공급에 대한 급전값과 참고용 모선가격을 산출하기 위하여 당해 급전주기에 대하여 작성되는 급전계획을 말한다. 전력거래소의 중앙급전발전기 및 중앙급전부하의 출력과 주파수제어 보조서비스 공급에 대한 급전지시는 대체로 제약급전계획에 의하지만 제약급전계획에 의하여 반영될 수 없는 발전기의 기동 및 정지, 보조서비스의 공급, 전압 및 무효전력의 제어, 전력계통의 구성 및 변경, 계통보호 등에 관한 급전지시는 필요할 경우 별도로 발령된다. 제약급전계획은 실 계통운영을 위한 것이므로 주파수제어를 위한 제약조건만을 고려하는 비제약급전계획과 달리 전력망제약 및 보조서비스제약을 포함한 필요한 모든 제약조건을 고려하게 된다."
3702,"제약운전 (制約運轉, Constraints)","각종 제약요인을 고려한 발전계획 운영을 제약운전이라고 한다. 발전기 운영은 원칙적으로 발전원가가 저렴한 발전기부터 발전에 참여시키고 발전원가가 비싼 발전기는 가동하지 않는 것이 합리적이다. 그러나 전력계통을 운영함에 있어서는 전력계통의 안정적 운용 또는 정책적 고려에 따라 여러 가지 제약요인들을 발전계획에 반영하게 되므로 연료비 우선순위와는 다른 발전기 운영이 이루어지게 된다. 발전경쟁전력시장(CBP)에서 가격결정발전계획은 연료비를 기준으로 한 발전계획이며, 운영발전계획은 각종 제약요인이 고려된 발전계획이다. 현재 주요하게 고려되고 있는 제약요인들은 아래와 같다. ▶ 연료제약(정부에서는 국내 석탄산업의 보호를 위하여 외국산 석탄에 비하여 경제성이 낮은 국내 석탄을 발전용 연료로 사용토록 하는 석탄산업 지원정책을 추진하고 있다. 이러한 정부 정책에 따라 연료비(경제성)와는 무관하게 국내탄을 사용하는 발전기를 운영발전계획에 반영하게 된다.) ▶ 송전제약(송전선로의 특성, 휴전작업 또는 선로고장 등으로 인한 송전용량의 한계로 연료비가 저렴한 발전기라도 발전계획에 반영되지 못하는 경우가 있으며, 반대로 대전력을 수송받는 수도권 지역에서는 이러한 송전제약 때문에 연료비가 비싼 발전기라도 운영발전계획에 반영될 수 있다.) ▶ 열공급 제약(지역난방을 공급하는 열병합발전소에서 난방용 열 공급을 위하여 발전기가 가동되는 경우에는 연료비와 무관하게 이를 운영발전계획에 반영한다.)"
3703,제약입찰 (制約入札),"열공급제약, 연료제약, 시운전, 성능시험, 자체시험 및 기타 발전기 운전제약이 발생한 경우 가격결정발전계획 반영 여부에 관계없이 일정한 출력을 유지하기 위해 입찰입력시 발전사업자가 행하는 입찰을 말한다."
3704,"제약증가/감소 발전/부하 (制約增加/減少 發電/負荷, Constrained On/Off Generation/Load)","중앙급전 발전기/부하가 비제약급전계획에서 배분된 발전량/구매량 이상으로 발전/소비를 한 경우에 이를 제약증가발전/부하라 하며, 비제약급 전계획에서 배분된 발전량/구매량 이하로 발전/소비를 한 경우에 이를 제약감소발전/부하라 한다. 이런 제약 감소/증가 발전/부하는 주파수를 유지하기 위한 예비력 확보, 송전선의 열용량, 안정도 제약, 전압유지를 위한 무효전력 공급 등 여러 가지 원인에 의해서 발생한다.예로 순간적인 수요변동과 발전기 고장 등에 의한 주파수 저하를 방지하기 위해 계통에 연결되어 운전 중인 석탄발전기를 최대 용량보다 낮게 운전하는 경우 제약감소 발전이 발생하고, 부하중심지의 전압이 매우 낮아 그 지역의 비싼 발전기를 기동하여 무효전력을 공급한 경우에는 제약증가발전이 발생한다."
3705,"제어계 (制御計, Control System)","제어대상, 제어장치 계통 등의 조합을 말한다."
3706,"제어대상 (制御對象, Controlled System)","제어 대상이 되는 것으로 기계, 공정, 시스템 등의 전체 또는 그 일부가 여기에 해당 된다."
3707,"제어량 (制御量, Controlled Variable)","제어루프에서 희망하는 값으로 제어하고자 하는 매개변수이다([예] : 온도, 압력, 유량, 레벨 등)"
3708,"제어밸브 (制御밸브, Control Valve)","제어장치의 조작부로서 조절부의 신호에 의하여 유체통로의 면적을 가감하여 유량제어 기능을 하는 밸브로 다이어프램 밸브가 가장 일반적임. 공기압신호에 의해 다이어프램이 움직여 스프링의 탄력과 평형되는 위치까지 밸브축을 이동시켜 밸브를 닫고, 공 기압이 감소하면 스프링이 다이어프램을 위로 밀어올려 밸브를 열게 된다."
3709,"제어밸브 예열 (制御밸브 豫熱, Control Valve Warming)","제어밸브의 저온취성 파괴방지를 위하여 주증기온도와 제어밸브 금속온도차이, 제어밸브의 내부와 외부 금속온도 차이가 기준치보다 적어야 한다."
3710,"제어봉 (制御棒, Control Rod)","원자로 출력을 제어하기 위해 노심 내에서 생성되는 중성자속을 조정(중성자 흡수에 의하여)하는 막대 또는 판상 물질을 말한다. 열중성자로에서는 붕소, 카드뮴, 하프늄 등의 중성자 흡수단면적이 큰 재료를 노심 내에 삽입하여 사용한다. 제어봉에는 거친 조정봉, 미세 조정봉, 안전봉 등이 있다. 제어봉의 역할은 원자로의 출력 조정 외에 처음에 설계된 초과반응도를 흡수한다든가 중성자속 분포의 균일화, 제논 진동의 억제 등도 수행한다. 카드뮴, 붕소 등으로 만들어진 막대로, 제어봉을 밀어 넣으면 중성자의 흡수가 증가하여 핵반응의 속도가 느려지고, 제어봉을 빼내면 중성장의 흡수가 감소하여 핵반응의 속도가 빨라진다. 원자로의 출력을 조정하는 기능을 한다.제어봉은 원자로를 긴급히 정지할 때에도 사용되며 그 때는 노심으로 급속히 삽입된다."
3711,"제어스위치 (制御스위치, Control Switch)",제어 회로를 개폐하기 위한 스위치이다.
3712,"제어실 (制御室, Control Room)",계측제어용 배전반이 설치되어 있는 방. 발전소 설비를 제어할 수 있는 제어용 배전반이 설치되어 있는 방이다.
3713,"제어유 (制御油, Control Oil)",터빈 조속장치의 조작 동력용 및 각종 보안장치의 신호전달과 조작용으로 사용되는 Oil로 터빈축에 연결된 Main Oil Pump에서 공급된다. EhC 조속기를 갖춘 터빈에는 윤활용으로 사용되는 Oil과 다른 별도의 유체로 이 고압제어유를 발생시키는 장치 (HPU : Hydra- ulic Power Unit)가 있는 것도 있다.
3714,"제어장치 (制御裝置, Controlling Device/ Con- troller/ Control Device)",조작 또는 동작 등 어떤 목적에 따라 양 또는 상태를 변화시키거나 또는 일정하게 유지시키기 위한 장치이다.
3715,"제어편차/편차 (制御偏差/偏差, Deviation/ Error)",목표치와 제어량의 차. Error는 측정치와 참값의 차/ Deviation은 측정치와 그 기대치와의 차라고도 하나 자동제어에서는 목표치와 제어량의 차이다.
3716,"제염 (臍炎, Rad-shield)","1. 방사성물질이 부착하여 오염된 인체나 시설을 대상으로 해서 이 방사성물질을 제거하는 것을 말한다. 사고로 오염된 경우 시설을 철거하고 관리구역을 일반구역으로 되돌리는 때와, 운전하고 있는 시설을 정지시키고 정기적으로 하는 경우가 있다. 제염방법에는 블러싱, 연마와 같은 기계적방법과 세제, 유기용매, 산, 알칼리를 사용하는 화학적 제염이 있다.2. 핵연료재처리 공정에서 사용후 핵연료로부터 핵분열생성물질을 제거하는 등 소정의 물질 이외의 것들을 제거하는 것을 말한다."
3717,제올라이트,"알칼리 및 알칼리토금속의 규산 알루미늄 수화물인 광물을 총칭하는 말로 색깔은 무색 투명하거나 백색 반투명하고, 비석이라고도 하며 종류는 많으나 함수량인 많은 점, 결정의 성질, 산상 등에 공통성이 있다."
3718,제올라이트 (Zeolite),"알칼리 및 알칼리 토금속의 규산알미늄 수화물인 광물의 총칭, 경도 6이하, 비중 약 2.2, 무색투명 또는 백색 반투명 결정. 구조적으로 결합이 느슨하여 다른 미립물질을 흡착할 수 있고 분리시키기도 하는 성질이 있으며 과거에는 경수 연화시에 많이 사용되었다."
3719,"제작자여유분 (製作者餘裕分, Maker's Margin)","출력, 효율 등의 성능 보증치 산정시 제작자가 설계 및 제작상 이론적으로 예견되지 않는 손실 또는 성능감소가 발생되는 경우를 대비하여 보증성능치를 이론적인 예상성능치 보다 약간 낮게 정하는 정도 또는 수치이다."
3720,"제조물책임 (製造物責任, Product Liability)","통상 갖추어야 할 안전성을 결여한 위험성을 가진 생산물(또는 결함생산물)로 인하여 그 생산물의 사용자·이용자 또는 제3자의 생명·신체 또는 재산상에 발생한 손해에 대해 생산자(제조업자, 판매업자, 수입업자 등)가 해야 할 손해배상 책임을 말한다."
3721,"제탁 (除濁, Removal of Turbidity)","물속에 여러가지 탁도성분(흙탕물, 미생물, 유기물 등)이 포함되어 섞여있기 때문에 이를 제거하여 맑은 물을 얻는 공정임. 탁도성분 제거방법에는 침전, 응집, 여과가 있으며 수질에 따라 각각 또는 조합하여 시행한다."
3722,제트가스터빈 (Jet Gas Turbine/ Jet Powered Gas Turbine),"제트엔진을 가스 발생기로 하고, 이것에 터빈을 연결한 가스터빈을 말한다."
3723,"제트기관 (제트機關, Jet Engine)","앞쪽에서 흡입한 공기를 압축하여 연료를 불어넣어 연소시켜서 발생한 가스를 뒤쪽으로 분출시켜서 그 반동으로 추진력을 얻는 기관. 엔진의 종류에는 터보젯, 터보팬, 터보프롭, 램젯 등이 있다."
3724,제트팬 (Jet Fan),케이싱에서 나오는 분류를 이용한 환기용 축류팬. 긴터널 천정에 적당한 간격으로 이 팬을 매달아 그 토출하는 분류에 의해 터널 내를 종류환기하는 방법을 취하는 경우가 많다.
3725,제트펌프 (Jet Pump),노즐에서 분사하는 유체(구동유체)에 의해 다른 피구동 유체를 퍼올리는 양식의 펌프. 효율은 30% 정도로 낮지만 구조가 간단하고 취급이 쉽기 때문에 고형물을 포함하는 물의 운반용으로 많이 사용한다. 석탄화력 발전소의 Bottom Ash와 Fly Ash를 운반하기 위하여 압력수를 분사시키는 펌프이다.
3726,"제품 (製品, Product)","프로세스의 결과로서 4가지(서비스, 하드웨어, 소프트웨어, 가공물질)로 분류되며, 발전 회사의 최종제품은 “전기” 및 “발전설비 구축물” 이다. - 서비스 : 운송 - 소프트웨어 : 컴퓨터 프로그램, 사전 - 하드웨어 : 엔진 기계부품 - 가공물질(processed materials) : 윤활유"
3727,"제한전압 (制限電壓, Residual Voltage or Disch- arge Voltage)",피뢰기의 제한전압이란 피뢰기의 방전중 과전압이 제한되어 양단자사이에 잔류하는 충격전압이며 방전전류의 파고치 및 파형에 의해 정하며 제한전압의 규정치는 파고치로 표시한다.
3728,"제한출력 (制限出力, Limit Output)","가스터빈의 성능 시험에서 사용되는 용어로서 가스온도 이외의 조건 예를 들면 축의 강도, 피구동기의 용량에 의하여 결정되는 발전단 출력을 말한다."
3729,"조내형펌프 (槽內型펌프, Wet Pit Type Pump)",수직축 펌프에서 펌프본체를 흡입수조 내의 액중에 매달아서 설치하는 구조이다.
3730,"조도 (照度, Illuminous Intensity)","어떤 면이 받는 빛의 세기를 나타내는 양. 면의 단위면적을 비추는 광선속으로 나타낸다. 그 크기는 면의 밝기를 결정하는 기본이 되지만, 빛의 반사율은 각 면의 성질에 따라 다르므로 조도가 그대로 면의 밝기를 나타내는 것은 아니다. 룩스 또는 포토를 단위로 한다. 빛을 받고 있는 면의 조도는 광원에서 멀어질수록, 또 면이 빛의 방향으로 기울어져 있을수록 작아지지만 여기에 대해서는 다음과 같은 법칙이 있다. 즉, 어떤 면의 조도는 ① 광원으로부터의 거리의 제곱에 반비례한다. ② 면의 기울기, 즉 그 면의 법선(수선)과 입사광선 사이의 각θ의 코사인(cosθ)에 비례한다. 따라서 어떤 면이 두 광원으로부터 빛을 받고 있을때 어느쪽 조도나 같아지도록 면의 위치를 조절하면 두 광원에서 그 면까지의 거리의 제곱의 비로 주어진다. 광도계를 비롯하여 빛의 양을 측정하는 기계에는 이 원리를 이용한것이 많다."
3731,"조력발전 (潮力發電, Tidal Energy Conversion System)","조수(潮水)의 간만(干滿)을 이용한 수력발전방식이다. 조석발전(潮汐發電)이라고도 한다. 조석의 규칙적인 운동을 이용하여 조석의 위치에너지를 운동에너지로 바꾸어 전기에너지로 전환하는 발전방법이다. 만조의 낙차가 큰 장소에 제방을 설치하고 만조시 바닷물을 저수지에 저장하였다가 간조시에 방류하여 발전한다. 조력발전은 간만의 차가 큰 지역으로 한정되고, 조위(潮位)의 변화가 1년 동안 균일하지 않으며 조위가 일정한 시간대에서는 발전할 수 없다는 것과 시설비가 많이 든다는 단점이 있다. 그러나 에너지원이 고갈될 염려가 없고 공해의 원인이 되지 않기 때문에 장차 유망한 발전방법의 하나이다. 현재 가동 중인 조력발전소는 프랑스 랭스강 어귀와 러시아의 키스라야, 캐나다의 아나폴리스 등이다. 한국은 황해 연안이 조석 간만의 차가 커서(인천 약 9m, 아산만 약 6m) 조력발전이 적합한 곳으로 평가되고 있다."
3732,조류발전,자연적인 조류(조수의 흐름)를 이용해 발전하는 기술
