순서,용어명,내용
2544,"양흡입펌프 (兩吸入펌프, Double Suction Pump)",원심 펌프에서 유체의 흡입구가 양쪽에 있는것이다.
2545,어드미턴스 (Admittance),"임피던스의 역수로 교류회로에서 전류값을 전압값으로 나눈 것으로 단위는 모(mho,  )를 사용한다."
2546,어큐뮬레이터 (Accumulator),1. 펌프 송출관에 연결되어 토출량이나 송출압력의 순간적인 변동을 완화하는 장치로 상부의 공기조에 의하여 이 작용을 하는 탱크를 에어 쳄버라고 부를때도 있다.2. 컴퓨터의 중앙처리 장치에서 처리예정 또는 처리된 데이타를 임시로 저장하는 레지스터이다.
2547,언더비드크랙 (Underbead Crack),용접에서 모재의 표면까지 진행되지 않은 비드밑 부분에 발생한 균열로 비파괴검사로서확인할 수 있다.
2548,언더컷 (Undercut),1. 용접에서 용착비드의 양쪽 모재가 지나치게 녹음으로 흠이나 굴곡이 생기는 현상이다.2. 랙(Rack) 공구 또는 호브(Hob)로 기어를 깎을 때 치수가 적으면 치의 간섭이 일어나 밑동이 깍이는 현상을 의미한다.
2549,언더피이닝 (Underpinning),"가설구조물의 밑에 기초를 삽입하는 공사로써 먼저 구조물을 지지한 다음, 기초를 삽입하고 새로운 기초공사의 완성 후 그 위에 구조물을 지지케 한다."
2550,언로더테스트 (Unloader Test),왕복압축기 언로더의 작동압력 및 복귀압력 또는 작동 상태를 확인하는 시험이다.
2551,얼랭 프로그래밍 언어(Erlang programming language),"대규모의 확장 가능한 실시간 병행(real-time concurrent) 시스템에서 사용되는 함수형 프로그래밍언어. 시스템 운영 중에도 프로그램을 변경할 수 있는 핫스왑기능이 지원된다. 얼랭(Erlang)은 에릭슨(Ericsson)사에서 전화교환기에 사용하기 위해 개발되었으나, 1998년 에아파치(Apache) 라이선스를 갖는 오픈소스(open-source)로 공개되었다. 얼랭은 은행, 게임, 전자상거래, 모바일메신저 등 대량의 데이터를 처리하는 서버시스템구축에 사용된다."
2552,업타임 (Up Time),"기계, 장치 등이 소정의 정상상태를 유지하여 사용을 계속할 수 있는 시간이다. 이와 같은 업 타임을 가능한 한 오래 계속되도록 하는 것이 생산목표치를 유지시키기 위해 필요할 뿐 아니라 재해발생의 기회도 감소시키게 된다."
2553,에너지 자립도,국내 에너지총소비량 대비 신 재생에너지 등 국내 생산 에너지량과 해외에서 개발 소유 취득한 에너지량의 비율을 말함.
2554,에너지 탄성치,일정기간 동안 에너지소비증가율을 GDP증가율로 나눈 값. 탄성치가 1을 상회하면 GDP성장율보다 에너지소비증가율이 더 크다는 것을 의미한다.
2555,에너지 회수 (Enregy recovery ),동일한 공정 또는 다른 공정에서 에너지를 다시 사용하기 위해 공정 이후 이용 가능한 에너지를 회수하는 것
2556,에너지 회수기간 (Energy payback/time ),시설의 건설기간 중 소비된 에너지와 수명기간 중 설비가동에 소요된 에너지를 회수하는 데 필요한 에너지 생산설비의 소요가동 기간
2557,에너지 회수율 (Energy Gain Factor ),설비 수명기간중의 총에너지생산량에서 총소비량을 차감한 양과 설비 건설기간중에 소요된 에너지량의 비율을 말한다.
2558,에너지/비용계수법 (Method of Energy/Cost Ratio ),소요자재 설비의 에너지원 단위를 적용한 항목별 상세비용분석을 통해 시설물의 건설에 필요한 소요에너지를 추정하는 방법이다.
2559,에너지간 경합 (Competition between Energy ),"에너지시장에 있어서 에너지산업간의 수요획득경쟁을 말한다. 종래는 조명·동력·냉방은 전기로, 급탕·주방은 가스로, 난방·가열은 석유, 석탄과 같은 에너지원으로 사용했으나, 최근에는 전력, 도시가스, 석유 등 각 산업이 다른 분야로 진출해 종래 에너지간의 울타리를 넘어선 경쟁이 격화되고 있다."
2560,"에너지관리시스템(Energy Management System,EMS)","배터리의 상태 모니터링과 PCS의 상태모니터링 및 제어를 하며, 컨트롤센터 등에서 ESS를 모니터링하고 제어하기 위한 운영시스템"
2561,에너지매체(Energy Medium ),"(1) 1차 에너지에서 이용계로 변환된 2차 에너지를 에너지매체(media)라고 한다. 전력, 석유제품, 연료가스 등. (2) 각종 에너지를 전하는 매체로 투명공간이나 투명체, 기계에너지는 탄환이나 용수철, 스프링, 압축기계, 화학에너지는 용액, 전기에너지는 전선 등."
2562,에너지사용량신고업체,에너지이용합리화법 제25조 및 동법 시행령 제22조에 의거 연료 및 열과 전력의 연간 사용량의 합계가 2천TOE 이상인 에너지사용자는 산업자원부령이 정하는 바에 따라 매년 1월 31일 까지 ①전년도의 에너지사용량 ②제품생산량등을 신고하여야 한다
2563,에너지소비효율등급표시제도(Indication of Energy Consumption Efficiency Grade ),"에너지이용합리화법 제17조, 18조 및 산업자원부고시 제1999-24(1999. 3. 8)호 효율관리기자재의 운영에 관한 규정에 의거,에너지사용기자재에 대하여 에너지사용량 또는 효율에 따라 1～5등급으로 구분하여 하고 대상제품의 에너지소비효율(사용량)에 따라 효율등급라벨(1~5등급)을 표시토록하고 최저소비효율기준 미달제품에 대해서 생산 또는 판매를 금지한다."
2564,"에너지원단위 (에너지原單位, Energy Intensity)",어떤 재화나 서비스의 생산 물량 단위 또는 부가가치 단위에 대한 에너지 투입량 비율이다.
2565,에너지원단위(Energy Intensity),단위 제품생산 또는 가치창출을 위하여 투입된 에너지량으로 TOE/ton-생산품 또는 TOE/백만원 등으로 표시 참고 : 에너지 집약도라고도 함. 
2566,"에너지유동계 (에너지流動系, Energy Flow Sys- tem)","에너지는 높은 곳에서 낮은 쪽으로 흐르며, 반대로 흐르는 일은 없다. 이와 같은 에너지의 유동체계에서 흐름의 배열을 대별하면 직렬연결방식(直列連結方式)과 병렬연결방식(竝列連結方式)이 있다. 일반적으로 직렬방식은 계열중의 하나가 고장나면 전체가 정지하지만 병렬방식은 하나가 정지해도 전체가 정지하는 일은 없다. 즉 병렬방식이 신뢰성이 크다."
2567,"에너지저장장치(Energy Storage System ,ESS)","전력수요가 적은 시간에 남는 전력을 저장하였다가 전력이 필요할 때 방전하여 전력을 공급하는 설비로 배터리, 전력제어장치(PCS), 전력관리시스템(PMS) 등 제반 시스템으로 구성 되어있다."
2568,에너지절약(Energy Saving ),에너지 공급자와 사용자가 에너지의 낭비를 줄이기 위해 채택한 수단 또는 그로 인한 효과. 여기에서는 소극적인 방법(예:단열)과 적극적인 방법(예:폐열이나 가스의 활용) 또는 조직적인 방법(예:수송수단의 변화)등이 있다.
2569,"에너지절약전문기업(Energy Service company ,ESCO)",에너지절약전문기업을 말한다. ESCO는 에너지 사용자를대신해 에너지절약 시설에 투자하고 이에 따른 에너지 절감액으로 투자비를 회수하는 기업이다. ESCO를 이용할 경우 에너지사용자는 경제적기술적 위험 부담없이 에너지를 절약할수 있다.
2570,"에너지제약 (에너지制約, Energy Constraints)","석탄, 가스 등 발전기 연료가 유한하여 지속적으로 운전이 불가능한 발전기는 입찰시 에너지 제약량을 입찰해야 하는데 이를 에너지 제약이라 한다. 실제 발전한 연료는 1시간 분량만 있으나, 제약량을 거래소에 제출하지 않는 경우 전력시장 운영자인 거래소는 연료가 무한한 것처럼 급전지시를 하게 되고, 시장참여자는 거래소의 급전지시를 이행하는 못하는 사태가 발생한다. 이것을 방지하기 위해 에너지 제약이 있는 발전기는 반드시 에너지 제약량을 입찰시 신고해야 한다. 또한 부하측면(양수)에서 보면, 양수발전소 상부저수지의 여유 용량이 1시간 펌핑용량인 경우, 입찰시 1시간에 해당하는 에너지 제약량을 제출하여야 한다. 만약 제출하지 않는 경우에는 상부저수지가 넘치는 결과가 발생할 수 있는 급전지시를 할 수 있다.변동비반영발전시장에서 에너지 제약량을 제출하는 발전기는 국내탄, 양수 및 수력 발전기이다. 도매전력시장에서는 입찰가격 조정을 통해 시장참여자가 연료량을 조절할 수 있지만, 선행급전계획 등의 왜곡을 방지하기 위해서는 반드시 에너지 제약량을 제출해야 한다."
2571,에너지탄성치(Energy Elasticity),일정기간 동안 에너지소비증가율을 GDP증가율로 나눈 값. 탄성치가 1을 상회하면 GDP성장율보다 에너지소비증가율이 더 크다는 것을 의미
2572,에너지탄소집약도 (에너지炭素集約度),에너지 소비량에 대한 탄소배출량 비율이다.
2573,에너지효율(Energy Efficiency ),"일정한 에너지 최종이용량의 공급에 대해, 몇배의 에너지원이 필요한가를 표시한 비율을 말한다. 이것은 에너지의 변환, 이차에너지의 수송율(손실율을 뺀 것), 이용계에 있어서 변환용의 3단계에 의해 결정된다. 환경오염의 견지에서 화석연료등은 에너지효율이 떨어져도 크린에너지로서 이용하는 것이 중요하게 된다."
2574,에로죤부식 (Erosion-Corrosion),기계적 작용에 대한 부식이 촉진될 경우를 말하며 캐비테이션 부식의 일종이다.
2575,"에스디카드(Secure Digital Card,SD card)","우표 크기의 플래시 메모리 카드. 매우 안정적이고 높은 저장 능력을 갖고 있으며, 개인 휴대 정보 단말기(PDA), 디지털 카메라, 디지털 뮤직 플레이어, 휴대 전화, 노트북 컴퓨터, 디지털 캠코더 등의 디지털 제품에 사용된다. 멀티미디어 카드(MMC)와 외관이 유사하나 차이점은 핀의 수가 9개로 MMC보다 2개 더 많고, 두께가 다소 두꺼우며, 동영상 등의 재생 시 보다 데이터 처리가 빠르고, 데이터 보안을 위한 암호 설정이 가능한 장점이 있다."
2576,"에스엔지(Satellite News Gathering,SNG)","야외에서 획득한 취재물을 위성을 통해 전송하는 방식. 야외에서 취재한 영상물을 스튜디오로 전송하는 방식에는 광케이블을 이용하는 유선방식과위성이나 마이크로웨이브, 그리고 이동통신을 이용하는 무선방식이 있다. SNG는 위성을 이용하는 방식으로 전송시스템을 주로 소형차량에 탑재하여 시스템을 구성하기 때문에 이동위성지구국(earth station)이라고도 부른다. SNG 방식은 중계차보다 전송로 구성이 간편하고 산악, 도서지역 등에서 기동성이 높아 뉴스취재용으로 많이 활용된다."
2577,에스지알버너 (Separate Gas Recirculation [SGR] Burner),버너 외측주위에 배기가스를 공급하여 Seal- ing 효과에 의하여 산소농도와 화염온도를 낮춰 NOX 발생을 감소시키는 버너이다.
2578,"에스코(Energy Service Company ,ESCO)",에너지절약 전문기업. 제3자의 에너지이용시설에 자체자금 또는 정책자금으로 선투자 한 후 이 시설을 사용하여 얻은 에너지 절감액에서 투자비와 이윤을 회수하는 기업
2579,에어로졸 (Aerosol),"미세하게 분리된 고체 또는 액체의 미립자가 기체로 부유하고 있는 상태로서 연무질이라고도 하며 입자는 보통 콜로이드 입자로서 정의된는 것보다 크며 일반적으로 분산상이 액체일 경우는 안개, 고체일 경우는 연기라 부른다. Aerosol은 입자간 거리가 크고 분산매의 점성율이 낮기 때문에 입자는 대단히 활발한 브라운운동을 나타낸다. Aerosol은 응축이나 동결발생시 핵으로 작용하며, 기후에도 중요한 영향을 미쳐 높은 농도에서는 심각한 대기오염을 발생시키기도 한다."
2580,에어로졸(Aerosols),"전형적인 크기가 0.01∼10㎜사이이고, 고체 또는 액체 상태로 대기 중에 적어도 수 시간 동안 머물면서 떠 있는 입자의 집합을 의미함. 에어로졸은 다양한 종류가 존재하며, 그중 두 가지의 에어로졸 입자, 황화염(Sulfates)과 검은 탄소(Black Carbon)가 기후변화에 중요한 역할을 하며, 이 둘은 모두 인간의 활동에 의해 발생된 것임. 미항공우주국(NASA)의 보고서에 따르면 지난 1976년부터 북극 상공에서 관측된 대기 온난화 원인이 에어로졸(Aerosols) 수치의 변화에 의한 것으로 보고 있음. 에어로졸은 자연과 인간의 활동에 의해 상공으로 배출되며, 태양 방사선의 반사와 흡수와 같은 지구의 기후에 직접적인 영향을 주고 구름의 발생 그리고 반사도와 같은 구름의 성질 변화에도 관여함. 미국 기후학자 Drew Shindell에 의해 수행된 이 새로운 연구는 30년 동안의 북극 온난화에서 에어로졸이 45% 또는 그 이상으로 크게 영향을 미쳤음을 증명하고 있음."
2581,"에어리퀴드사(Air Liquide,AL)","프랑스에 본사를 둔 산업용 가스 전문회사로 석유화학, 전자, 철강산업을 포함한 국내 주요 산업분야에 산업용 가스 및 관련 서비스를 공급해 오고 있음. 에어리퀴드 코리아는 현재 여수, 부천, 이천, 천안, 당진, 구미, 익산, 부산사업장에서 산업용 가스를 직접 제조 공급하고 있음."
2582,"에이디에스-비(Automatic Dependent Surveillance-Broadcast,ADS-B)","GPS(Global Positioning System) 위성 항법 시스템과 1,090 MHz 전송 링크를 이용하여 항공기 감시 정보를 일정 주기마다 지상의 항공 교통 관제(ATC: Air Traffic Control) 및 다른 항공기에 자동으로 방송(broadcast)하는 항공기 감시 체계.ADS-B 시스템은 항공기의 감시 정보(항공기 식별 부호, 위치, 속도, 방향 등)를 1초 단위로 지상의 ATC(Air Traffic Control) 시스템과 다른 항공기에 방송(broadcast)한다. 이용자는 화면에 표시된 정보를 통하여 항공기 주변의 감시 정보를 확인할 수 있다. 따라서 ADS-B 시스템을 이용하여, 가시선의 미확보로 인한 통신 두절 등 항공기 제한 사항을 최소한으로 줄이고, 항공 관제 기능을 향상시켜 항공기 충돌을 방지할 수 있다. ADS-B는 기존의 레이더 기반 항공 관제보다 정보 수집 및 전달 속도가 빠르고, 보다 정확한 정보를 제공하는 시스템이다. "
2583,"에이엠디(Advanced Micro Devices,AMD)","인텔사의 X86 계열 마이크로프로세서와 호환되는 애슬론(Athlon) 시리즈를 만드는 미국의 반도체 기업. AMD의 K6와 애슬론의 성능은 동급의 인텔 펜티엄 계열에 비해 거의 동등, 또는 그 이상이라고 평가된다."
2584,"에이접점/상시개접점 (에이接點/常時開接點, Arbeit Contact(A Contact)/ Normally Open Contact)","평상시 개로 상태에 있는 접점을 말하며, 반드시 소문자 a로 표시한다. 물리적으로 외부에서 힘을 주거나 전기적으로 릴레이에 전류가 흐르면 동작하여 접점이 닫힌다."
2585,"에이종절연 (A 種 絶緣, Class A Insulation)","최고허용온도 105℃에 충분히 견딜 수 있는 재료로 된 절연이다. 무명, 명주, 종이로 구성되며 바니시류로 함침하거나 항상 유중에 넣는다."
2586,"에이치디알(High Dynamic Range,HDR)","디지털 영상 처리 과정에서 높은 명암 비율을 제공해 높은 수준의 영상 표현을 가능케 해주는 기술.HDR 기술은 밝은 부분은 더 밝게, 어두운 부분은 더 어둡게 보정하여 기존 로컬 디밍(local dimming) 방식보다 더 명암비를 향상시켜 보다 현실감 있는 영상을 제공하는 기술이다. 태양의 강렬한 빛부터 어두운 밤하늘의 별빛까지 현실에 존재하는 다양한 밝기를 표현할 수 있다. "
2587,"에이치엘에스(Hypertext Transfer Protocol Live Streaming,HLS)","애플(Apple)사에서 만든 하이퍼텍스트 전송 규약(HTTP) 기반의 미디어 전송 프로토콜.아이폰, 아이패드, 맥(Mac) 등에서 생방송은 물론 오디오, 비디오를 전송할 수 있으며, 사용하는 기기나 망 환경에 따라 비트율이 다르게 전송이 된다. 전송되는 콘텐츠는 암호화되며 사용자 인증 서비스도 제공된다. HLS 프로토콜은 스트리밍 데이터를 엠펙투 티에스(MPEG-2 TS: MPEG-2 Transport stream)에 담아 시간 단위로 잘게 쪼개고, 재생 파일 정보는 m3u8 확장자를 가진 파일을 생성하여 전송한다. MPEG에서는 MPEG-2 TS와 HLS 등을 종합하여 HTTP 동적 적응 스트리밍(DASH: Dynamic Adaptive Streaming over HTTP) 표준을 제정하였다. 이후 MPEG-2 TS의 차세대 버전인 엠엠티(MMT: MPEG Media Transport)를 만들었다. MMT의 정식 명칭은 엠펙 에이치 파트원(MPEG-H Part 1)이다. "
2588,"에이치종절연 (H 種 絶緣, Class H Insulation)","허용 최고온도 180℃ 에 충분히 견딜 수 있는 재료로 구성된 절연이다. 마이카, 유리섬유 등의 재료를 규소수지 또는 동등한 성질을 가진 재료로 이루어지는 접착재료와 함께 사용한다."
2589,"에이프런급탄기 (에이프런給炭機, Apron Feeder)",주로 Crusher 전단에 설치되어 있으며 에이프런 컨베이어를 이용하여 석탄을 정량으로 공급하는 기기이다.
2590,에이피티엑스 코덱(AptX codec),"고효율 저전력 오디오코덱. 에이피티엑스(aptX) 코덱은 MP3보다 연산량이 매우 적어 전력이 적게 소비되며, 압축효율이 대단히 높아 CD와 같은 음질을 제공한다. 또한 기존 블루투스 전송방식인 부대역부호화방식(SBC: Subband Coding) 코덱에 비해서도 압축효율이 높고 향상된 음질을 제공한다. 따라서 스마트폰, 무선헤드폰, 무선스피커와 같은 블루투스기기 등에 사용된다. aptX 코덱은 영국 오디오프로세싱 테크놀로지(Audio Processing Technology)사에서 개발하였고, 2010년 CSR사에 인수되었다."
2591,"에칭/부식 (에칭 腐蝕, Etching)",현미경으로 금속을 관찰하기 위해 금속면을 약품으로 가볍게 부식시키는 것을 말한다.
2592,에코파트너,협력업체를 대상으로 환경감사를 실시해 일정 환경기준을 준수한 업체에서만 납품권한을 주는 제도
2593,"에프오비티브이(Future Of Broadcast TeleVision Initiative,FOBTV)","미래지상파방송을 위한 기술개발 및 글로벌 단일방송 표준화와 산업진흥에 대한 글로벌공동대응을 위해 2011년 설립된 국제표준화협력단체.지상파로 초고화질텔레비전(UHDTV)을 실현하기 위한 표준화규격ATSC 3.0을 제정하기 위해 설립되었다. 창립회원사로 에이티에스시(ATSC), 시비시(CBC), 시아르시(CRC), 디브이비(DVB), 이비유(EBU), 이티아르아이(ETRI), 티브이글로보(TV GLOBO), 아이이이이-비티에스(IEEE-BTS), 엔에이비(NAB), 엔이아르시-디티브이(NERC-DTV), 엔에이치케이(NHK), 피비에스(PBS), 에스이티(SET) 등 각 대륙을 대표하는 방송관계사와 학계, 표준화기구가 동참하였으며, 글로벌공동협력이라는 취지와 부합한 진용을 갖추고 있다. 2015년에는 창립회원사 포함 70여개 기관이 참여하여 활동 중이며, 한국방송사로는 케이비에스(KBS)와 에스비에스(SBS)가 참여하고있다. FOBTV는 실질적 표준화기구가 아닌 글로벌협력단체의 성격을 띠고 있어, 다양한 논의가 이루어진다. "
2594,"에프종절연 (F 種 絶緣, Class F Insulation)","최고 허용온도 155℃ 에 충분히 견딜 수 있는 재료로 구성된 절연이다. 마이카, 유리섬유 등의 재료를 실리콘, 알키드수지 등의 접착 재료와 함께 사용해서 구성된다."
2595,"에프티엔(Faster-Than-Nyquist,FTN)","나이키스트 속도(Nyquist rate)로 정보를 전송하는 기존의 전송 방식과 동일한 채널 대역폭을 사용하면서, 나이키스트 속도보다 높은 전송률로 신호를 전송하는 기술.기존의 방송·통신 시스템은 시간적으로 인접한 송신 부호 간 간섭(ISI: Inter-Symbol Interference)이 발생하지 않도록 설계된 나이키스트 속도(Niquist rate)로 신호를 전송한다. 이에 반하여 FTN은 나이키스트 속도 방식보다 높은 전송율로 신호를 전송하기 때문에 인접한 부호 간 간섭(ISI)이 발생하지만 간섭의 영향을 미리 알고 있기 때문에 수신기에서 이를 제거할 수 있다. 다만 FTN 수신기는 인접한 부호 간 간섭(ISI)을 제거하기 위한 신호 처리부가 추가되므로 수신기 구현 복잡도가 증가하는 단점이 있다. "
2596,"엑스비 (X比, X-Ratio)",A/H를 통과하는 가스의 열용량에 대한 A/H 통과 공기의 열용량비이다. 이것은 공기온도 상승에 대한 가스온도강하의 비로서도 표시될 수 있는 무차원의 계수이다.
2597,"엑스형 압축기 (X形 壓縮機, X Type Compre- ssor)",실린더가 크랭크 축에 대하여 X형으로 배열된 형식의 압축기이다.
2598,"엔디엔(Named Data Networking,NDN)","인터넷에서 콘텐츠 자체의 정보와 라우터 기능만을 이용하여 목적지로 데이터를 전송하는 기술.기존의 인터넷 프로토콜(IP) 망에서는 콘텐츠와는 아무 상관없이, 클라이언트와 서버가 패킷의 헤더에 내장되어 있는 주소정보만을 이용하여 연결된다. 그러나 NDN은 해시테이블(hash table)에 기반을 두는 피투피(P2P: Peer-to-Peer) 시스템과 유사하게 콘텐츠자체의 정보와 라우터 기능만을 이용하여 목적지를 찾아간다. 서버와 IP 주소기반인 기존 인터넷전달망을 대체할 미래의 인터넷 아키텍처로 고려된다. NDN은 콘텐츠 중심네트워크(CCN: Content Centric Networking)와 동일한개념이다. "
2599,엔탈피 (Enthalpy),"어떤 상태의 유체가 가지고 있는 열에너지이며 유체속에 저장된 내부에너지와 상태유지를 위한 기계적에너지의 합으로 정의되는 열역학적 성질이다. 일반적으로 엔탈피(H)는유체가 가지고 있는 총에너지를 말하며, 단위질량에 대한 엔탈피는 비엔탈피(h)라 하고 단위는 kcal/kg으로 표시한다.H =u + APV 또는 h =u + Apv여기에서 u는 내부에너지, P는 압력, V는 체적, A는 일의 열당량이다."
2600,엔트로피 (Entropy),"에너지의 사용가치를 나타내는 열역학적 상태량으로 다음식으로 나타낼 수 있다. 열량을 주고, 받는 과정에서는 반드시 엔트로피 증감이 발생하는데 이것을 식으로 나타내면 다음과 같다. 열량변화량(dQ)는 같으나 절대온도(K)가 다른 두 경우를 생각해 보자. 온도(K)가 높을수록 엔트로피 변화량(ds)는 적어진다. 이것을 바꿔 말하면 같은 열량을 보유한다 하더라도 온도가 높은 쪽의 열이 더 유용하게 사용될 수 있음을 나타낸다. 즉 100℃ 물과 30℃ 의 물이 같은 열량을 보유하고 있다하더라도 100℃ 물이 훨씬 더 실생활에 유용하게 쓰인다. 따라서 열량 변화량이 같다면 엔트로피 변화량이 적은 쪽이 더 유용함을 의미한다."
2601,엘니뇨(El Nino),엘니뇨는 불규칙하게 나타나는 기후 현상으로서 대개 3~5년이 주기임. 엘니뇨는 보통 그 징후가 크리스마스 기간에 페루 연안 바닷물 온도가 올라가는 것으로 나타나면서 이 지역 주민들이 아기 예수란 뜻의 엘니뇨(El Nino)로 불리게 되었음. 이 현상은 열대 태평양의 무역풍이 주기적 변화에 따라 약해지면서 비정상적으로 동태평양 바닷물의 표면온도를 높이는 것을 말함. 이러한 변화는 범지구적인 기후 시스템에 영향을 미쳐 세계 곳곳에 이상 기상현상으로 인한 피해를 증가 시킴.
2602,엘보 (Elbow),굽은 관로의 접속에 사용하는 관이음이다.
2603,"엘형용적식압축기 (L形 容積式 壓縮機, L Type Com- pressor)",실린더가 크랭크 축에 대하여 L형으로 배열된 형식의 압축기이다.
2604,엠에이치디발전 (Magneto Hydro Dynamic Gen- eration(MHD)),"전자유체역학을 이용한 발전방법이다. 기체를 고온의 전리된 상태, 즉 플라즈마(Plasma)로 만들어 자장 안을 통과시키면 도전성기체의 운동과 자장과의 상호작용으로 기전력이 발생하는 것을 이용한다. 발전효율이 50%이상이며 발전기 출력은 자계의 2승에 비례하기 때문에 강력한 자계를 발생시키는데 초전도 마그네트가 필수적이다."
