순서,용어명,내용
1304,미끄럼 (Slip),"1.베인출구에서 베인수가 유한한 경우 절대속도의 원주 방향성분과 베인수가 무한한 경우 절대속도의 원주방향성분 사이에 차이를 일으키는 현상이다.2.유도전동기의 회전자에 전류가 흐로면 이 전류가 회전자속과의 곱에 비례하는 토크가 발생하여 회전자는 그 회전자속과 같은 방향으로 회전한다. 회전자가 동기속도로 회전하면 2차 도체와 회전자속과의 상대속도는 ''''0''''이 되어 자속을 끊을 수 없으므로 2차 전류가 흐르지 않고 토크도 발생되지 않는다. 전동기가 토크를 발생하여 회전을 하기 위해서는 회전자의 속도는 반드시 동기속도 이하로 되어야 한다. 즉 회전자의 속도(동기속도)를 Ns(RPS), 유도전동기의 회전속도를 N(RPS)라고 하면 전부하시 속도감소분해 대한 동기속도의 비율을 슬립이라 한다. 슬립S =(Ns - N)/Ns"
1305,"미끄럼률 (미끄럼率, Slip Factor)",기어는 톱니의 미끄럼 접촉으로 움직임을 전달하는데 여기서 치면이 미끄러지는 정도를 미끄럼률이라고 한다.
1306,"미끄럼베어링 (Sliding Bearing, Plane Bearing)",축과 축받이가 기구학적으로 면접촉을 하고 축의 회전과 함께 미끄럼이 발생되는 베어링을 말한다.
1307,미러링크(MirrorLink),"유무선통신을 기반으로 스마트폰과 차량용 인포테인먼트(IVI: In-Vehicle Infotainment)시스템을 일체화하는 기술.스마트폰의 음악파일, 비디오, 내비게이션 등과 같은 다양한 기능이 유무선통신망을 거쳐 차량의 큰화면에서 그대로 사용할 수 있다. 미러링크는 국제단체인 카커넥티비티컨소시엄(CCC: Car ConnectivityConsortium)에서 제정된표준이다. 국내에서는 한국정보통신기술협회(TTA)가 CCC의 미러링크제품과 애플리케이션에 대한 국제공인시험소로 지정되어있다."
1308,"미분기 (微分器, Differentiator)",입력신호를 미분하여 출력하는 계기이다.
1309,"미분기 (微粉機/微粉炭機, Pulverizer, Mill)","석탄을 미세하게 분쇄하는 기계로 석탄을 동력, 용수철, 원심력 등을 이용하여 갈아 부수는 것과 충격식을 이용한 것이 있다."
1310,"미분기동력 (微粉機動力, Mill Horse Power)",미분기의 운전으로 소비되는 동력을 말한다.
1311,"미분기런백 (微粉機런백, Pulverizer Runback)",Bowl형 미분기를 사용하는 직접연소방식 보일러에서 정상운전중인 미분기에 이상상태(Bowl 상하 압력차 과다 및 과부하시)가 발생하면 미분기에 반입되는 석탄량을 줄여주기 위하여 원탄 급탄기가 최소속도로 자동으로 감소되는 현상이다.
1312,"미분기배출석탄손실 (微粉機排出石炭損失, Heat Loss Due to Heat In Pulverizer Reject)",미분탄 연소 보일러에 공급된 연료 중 미분기 출구에서 배출되어 연소되지 못한 석탄으로 인하여 발생되는 보일러 손실이다. 일반적으로 미분기에서 Pyrite로 배출되는 석탄은 단단하고 열량이 낮은 괴탄이 많으나 미분기의 성능저하 또는 운전불량으로 양질의 석탄이 배출되는 경우도 있다. 공급된 연료 1kg 당 손실열량(Lr)은 다음과 같다.
1313,"미분기부하율 (微分機負荷率, Mill Load Ratio)",미분기의 정격부하에 대한 실제 부하의 비율이다.
1314,"미분기부하율 (微粉機負荷率, Mill Load Ratio)",미분기의 정격부하에 대한 실제 부하의 비율을 의미한다.
1315,"미분기차압 (微粉機差壓, Mill Differential Pressure)",미분기 입구와 출구의 순환공기의 압력차로서 미분기내의 석탄량 파악에 이용되며 차압이 규정치 이하일 경우에는 Raw Coal Feeder의 속도를 줄여 석탄 공급량을 줄인다.
1316,"미분도 (微粉度, Fineness)","분쇄된 입자의 미세한 정도를 나타내며, 미분탄 보일러에서 양호한 연소를 위하여 작고 균일한 미분도를 유지하는 것이 필요하나 입도가 너무 작으면 분쇄에 요하는 동력 및 유지비가 증가하기 때문에 다음과 같이 200메시 체 통과율을 경제적 미분도로 결정하고 있다. 무연탄 : 80~85%, 고도 역청탄 : 65~75%, 아역청탄 55~65%, 갈탄 : 40~45%."
1317,"미분동작 (微分動作, Derivative Action)",편차의 변화속도에 비례하는 조작량을 내는 조절동작을 미분동작(D동작) 이라 한다. 미분동작은 단독으로 사용되지 않고 비례동작과 결합하여 사용한다.
1318,"미분시간 (微分時間, Derivative Time)",일정한 속도 A로 증가하는 편차를 비례-미분동작 조절기에 가하면 조절기의 출력은 먼저 미분동작에 의하여 급격히 증가하고 점차로 편차에 비례하는 출력이 나타나게 된다. 조절기의 출력은 입력속도 A 및 비례감소가 일정하다면 시간 T에 비례하여 커진다. 이때 TD를 미분시간이라 하며 미분동작의 세기를 나타내는 매개변수가 된다. PD동작 : Y = Kp(e + Td de /dt)/ PID 동작 : Y =Kp (e + 1 / Ti ∫edt+Tdde/dt)
1319,"미분제어동작(D동작) (微分制御動作(D動作), Deri- vative Control Action)",제어 편차신호의 변화율에 비례하여 조작부로 신호를 발생시키는 것으로 조절기의 조작신호가 실제값에 추종만 할 경우 계통에 불안정을 초래하게 된다. 이러한 장애를 제거하기 위해 설정치와 실제값의 편차에서 변화하는 속도를 검출하여 변화 속도가 빠르면 실제값은 검출치보다 훨씬 앞서 있을 것이라는 예견을 하여 변화속도에 비례하는 조작신호를 조작부로 발생시켜 실제값의 변화를 제동하는 역할을 한다. 통상 온도제어루프에 채용한다.
1320,"미분탄 (微粉炭, Pulverized Coal/Powdered Coal)",미분기에서 미세하게 분쇄된 탄이다.
1321,"미분탄관 (微粉炭管, Pulverized Fuel Pipe)",미분기 출구 또는 미분탄 저장조에서 버너까지 미분탄을 공급하는 배관을 말한다.
1322,"미분탄버너 (微粉炭버너, Pulverized Coal Bur ner)",석탄의 연소효율을 높이기 위하여 미분기로 분쇄하여 통상 200Mesh 통과분이 80% 정도되는 입도의 미분탄을 노내로 분사시켜 연소시키는 장치로 다음과 같은 장점을 갖고있다. ① 과잉 공기가 적다. ② 사용탄의 범위가 넓다. ③ 부하변동에 추종성이 좋다. ④ 고온 공기를 사용해서 연소효율이 높다. ⑤ 연소조절이 용이해서 점화 또는 소화가 단시간에 가능하다. ⑥ 액체 또는 기체연료와 혼소가 용이하다.
1323,"미분탄분리기 (微粉炭分離機, Classifier/Separator)",미분기에서 분쇄된 미분탄을 규정된 크기의 입자만 통과시켜 분리하는 장치이며 큰 입자는 다시 미분기로 보낸다.
1324,"미분탄분배기 (微粉炭分配機, Pulverized Coal Distributor)",미분기에서 나온 미분탄을 몇 개의 미분탄 관에 분배하는 장치이다.
1325,"미분탄사이클론 (微粉炭사이클론, Cyclone/Pul verized Coal Separator)",미분탄과 이송용 재순환 공기가 섞인 혼합물을 미분탄과 재순환 공기의 원심력을 이용하여 분리하는 장치를 말한다.
1326,"미분탄수송펌프 (微粉炭輸送펌프, Pulverized Coal Transfer Pump)",사이클론에서 포집된 미분탄을 저장조로 보내는 펌프이다.
1327,"미분탄저탄조 (微粉炭貯炭槽, Pulverized Coal Storage Bunker)",미분기에서 분쇄된 미분탄을 버너에 공급하기 전에 일시적으로 저장시키는 저탄조로 간접 연소방식에서 사용된다.
1328,미세먼지 (微細먼지),"미세먼지란 우리 눈에 보이지 않을 정도로 아주 가늘고 작은 먼지 입자를 말하는 것이다. 이런 미세먼지는 숨을 쉴 때 호흡 기관을 통해 들어가 폐속으로 침투해서 폐의 기능을 떨어뜨리고, 여러가지 병을 막아내는 힘인 면역 기능을 떨어뜨리고, 약하게 만든다."
1329,미세조류 배양기술,발전소에서 배출되는 CO2 가스를 활용하여 미세조류를 대량 배양하여 친환경에너지인 바이오연료를 개발하는 기술
1330,"미세조정 (微細調整, Fine Adjustment)",측정장치 등에서 조정부분을 좁은 범위내에서 미세하게 조정하는 것
1331,미스트 (Mist),"기체중에 부유하고 있는 액체 미립자로 입경의 크기는 0.01~10㎛까지이며 증기가 기체중에 응축된 것이 많으나 액체가 날아가서 거품이 되거나, 분무되거나 한 것도 있다. 대기오염의 원인이 되므로 제거해야 되며 금속의 산세정, 크롬도금, 시안화 동 도금 등에서 많이 발생한다."
1332,"미연소연료드레인밸브 (未然素연료드레인밸브, False Start Drain Valve)",가스터빈에서 액체 연료로 기동시 폭발을 방지하기 위해 미연소된 오일을 가스터빈 밖으로 배출시키는 장치로 보통 연소실에서부터 배기가스덕트에 이르기까지 3~5개소에 설치되어 있다.
1333,"미연탄소 (未然炭素, Unburned Carbon)","Fly Ash나 Bottom Ash중 연료의 불완전 연소로 인하여 연소되지 않은 가연성 물질이 있는데, 이들의 대부분이 탄소로 구성되어 있으므로 미연탄소라 부른다."
1334,"미연탄소손실 (未然炭素損失, Heat Loss Due to Unburned Carbon)","석탄과 같은 고체연료중에 함유된 탄소가 완전연소를 하지 못하고 그 중 일부가 미연상태로 배출되므로써 미연탄소분의 발열량만큼 유효열량이 감소되어 발생하는 보일러 손실로 보일러에 공급된 연료 1㎏당 손실열량(Luc)은 다음과 같다.Luc =Wd''''p'''' × Hd''''p''''(㎉/㎏)Wd''''p'''' = [a/(1-u/100)] × [㎏ / ㎏ of Fuel]Wd''''p''''는 연료 1㎏당 건조재의 총중량(㎏), a는 연료 1㎏중에 함유된 회분의 양(㎏), u는 건조재중의 미연탄소분 함유율(%), Hd''''p''''는 건조재의 발열량(㎉/㎏) 으로써 측정치이나 미연탄소의 평균 발열량(약 8,056㎉/㎏) × 건조재중의 미연탄소함량(U)으로 산출하기도 한다."
1335,미크론 (Micron),"기호는 M, 길이의 단위로 0.001mm 이다."
1336,민하드웨어(Bare metal),"동의어: 베어메탈 소프트웨어가 설치되어 있지 않은 컴퓨터하드웨어. 베어메탈(bare metal)의 일반적 의미는 금속재질이 그대로 드러나는 상태를 뜻하지만, IT 업계에서는 운영체제(OS)를 포함하여 어떤 소프트웨어도 설치되어 있지 않은 하드웨어를 의미한다."
1337,"밀도 (密度, Density)","물질의 단위 체적당의 질량을 말한다. 질량을 m, 체적을 V, 밀도를 p로 하면 p = m/V(kg/㎥ ). 밀도와 비중과의 관계는 중력가속도를 g로 하면 r =pg(kgf/㎥ 또는 N/㎥) 이다."
1338,"밀봉공기파이프 (密封空氣파이프, Seal Air Pipe)",가압연소 보일러 등에서 노내가스의 누출을 방지하기 위하여 노벽 관통부로 가압공기를 공급하는 관이다.
1339,"밀봉수 (密封水, Gland Seal Water)",밸브의 스템이나 펌프의 축이 케이싱을 관통하는 부분의 누설을 방지하기 위하여 사용되는 물이다.
1340,"밀봉수전자밸브 (密封水電子밸브, Solenoid Valve For Sealing)","펌프를 외부로부터 수밀봉하는 방식의 경우, 밀봉수관 중에 설치되는 전자밸브를 말한다."
1341,"밀봉수펌프 (密封水펌프, Seal Water Pump/ Lubricating Water Pump)","펌프 축의 밀봉부나 수중베어링 등에 물을 공급하여 밀봉하거나, 윤활 작용하는 물을 공급하는 펌프이다."
1342,"밀봉유장치 (密封油裝置, Seal Oil Unit)","발전기 내에 충진된 1~4Kg/㎠ 정도의 수소가스가 축관통 부분을 통해 밖으로 새어나오는 것을 막기위한 장치로 밀봉유 압력은 발전기내 가스압력보다 0.5~1.0Kg/㎠정도 높게 유지시킨다,"
1343,"밀봉유장치백업시험 (密封油裝置백업試驗, Seal Oil Back Up Test)",주 밀봉유 펌프가 정지하였을 때 비상용 밀봉유 펌프 및 터빈유로 부터 백업이 정상적으로 이루어지는가를 확인하는 시험이다.
1344,"밀봉증기 조절기 (密封蒸氣調節器, Gland Steam Regulator/Seal Steam Regulator)",복수터빈에서 저압측의 Gland에는 공기가 침입하기 때문에 Labyrinth Packing의 중간에 대기압 이상의 증기를 보내어 밀봉하며 이 밀봉증기를 부하변화에 관계없이 일정한 압력으로 유지하기 위한 조절기이다.
1345,"밀봉증기공급밸브 (密封蒸氣供給밸브, Seal Steam Feed Valve)",터빈 또는 급수펌프 구동용 터빈(BFPT)에 밀봉증기를 공급해 주는 밸브이다.
1346,"밀봉증기디버팅밸브 (密封蒸氣디버팅밸브, Seal Steam Diverting Valve)",터빈 밀봉용 증기가 과도하게 공급될때 이 증기를 복수기나 저압가열기로 보내기 위한 Change-Over 밸브이며 Unloading Valve 다음에 설치된다.
1347,"밀봉증기복수기 (密封蒸氣復水器, Gland Steam Condenser)",글랜드로부터의 누설 증기를 응축시키는 복수기를 말한다.
1348,"밀봉증기팬 (密封蒸氣팬, Steam Packing Exhauster /Gland Steam Exhauster)","Gland Steam Condenser의 진공을 유지해 주고 불응축가스, 공기 등을 대기로 불어내기위한 팬이다."
1349,"밀폐급수가열기 (密閉給水加熱器, Closed Feedwater Heater)",가열용 증기와 가열되는 급수가 직접 혼합되지 않도록 유로가 각각 구별되어 있는 급수가열기를 말한다.
1350,"밀폐사이클가스터빈 (密閉사이클가스터빈, Closed Cycle Gas Turbine)","압축기, 가열기, 팽창기(터빈) 및 냉각기의 4개 과정으로 구성된 가스터빈 사이클로서 동작유체는 공기이며 연료의 연소 과정이 없다. 압축기에서 가압된 압축공기가 가열기에서 외부 열원에 의하여 가열된 후 가스터빈을 구동하고 그 배기는 다시 냉각기로 들어가 외부매체에 의하여 냉각되므로 동작유체인 공기가 외부로 방출되지 않는 사이클이다."
1351,바 (Bar),"1.면적 1㎡ 에 100,000 N(Newton)의 힘이 작용하는 압력으로 1 BAR=1.0197Kg/㎠이다. 2.나무, 금속 등의 막대기, 봉을 의미한다."
1352,바 스크린 (Bar Screen),Trash Rack 참조
1353,"바깥쪽나사밸브스템비회전식밸브 (바깥쪽螺絲밸브스템非回轉式밸브, Outside Screw Non-Rotating Stem Type Valve)",바깥쪽 나사식이고 밸브의 개폐조작 때 밸브스템이 회전하지 않고 승강하는 형식의 밸브이다.
1354,"바깥쪽나사밸브스템중공식밸브 (바깥쪽螺絲밸브스템中空式밸브, Outside Non-Rising Spindle Rising Hollow Stem Type Valve)","밸브스템이 숫나사와 암나사의 조합으로 이루어지고, 밸브의 개폐조작 때 숫나사를 가지는 밸브스템이 정위치에서 회전하고 암나사를 가지는 밸브스템이 승강하는 형식이다."
1355,"바깥쪽나사밸브스템회전식밸브 (바깥쪽螺絲밸브스템回轉式밸브, Outside Screw Rotating Stem Type Valve)",바깥쪽 나사식이고 밸브의 개폐조작 때 밸브스템이 회전하면서 승강하는 형식의 밸브이다.
1356,"바깥쪽나사식밸브 (바깥쪽螺絲式밸브, Outside Screw Type Valve)",밸브스템 작동용 나사 결합부가 덮개보다 바깥쪽에 있는 형식의 밸브이다.
1357,"바나듐부식 (바나듐腐蝕, Vanadium Attack)",중유 또는 원유중의 바나듐 화합물을 주성분으로 하는 융점이 낮은 회분이 과열기 등의 고온부 전열면에 융착해서 관 표면을 보호하는 산화피막을 융해시키고 연료중의 유황화합물과 반응해서 바나듐산염이나 유산염을 생성해 금속 표면에 급격한 부식을 일으키는 현상으로 고온부식의 일종이다.
1358,바니시니스 (Varnish),"1.도료의 일종으로 물체에 바르면 매끈하고 광택이 있는 투명박막이 생기는 도료로 오일바니시와 휘발성바니시 2종이 있다. 2.아마인유와 같은 건성기름 또는 알코올과 같은 용제에 수지나 아스팔트 등을 용해한 것으로 전기절연용 바니시의 경우 전기기기의 쇠붙이, 철판, 코어절연, 코일합침 등 에 쓰인다."
1359,"바렐형케이싱 (바렐형케이싱, Barrel-Type Casing)",단지 모양의 터빈 외부 케이싱으로 수평 플랜지가 없는 고압용 케이싱이다.
1360,바르샤바 메커니즘(Warsaw International Mechanism),"2010년 제16차 당사국총회(멕시코 칸쿤)는 손실과 피해 분야 프로그램을 채택하였다. 2013년 제19차 당사국총회(폴란드 바르샤바)는 손실과 피해 문제를 다루기 위하여 ‘바르샤바 메커니즘’을 설립하였다. 바르샤바 메커니즘은 초기 논의를 진행하는 임시 기구로 2016년까지 운영될 예정 이었다. 그러나 파리협정 제8조에서 손실과 피해를 단독 조항으로 다루고 그 중요성을 인정하면서 바르샤바 메커니즘을 지속하기로 합의한 것이다.바르샤바 메커니즘은 위험관리, 관련 기구와 조직, 이해관계자 간 연계, 재원, 기술지원 등의 역할을 하는 집행위원회를 설치하여 시범 사업을 추진하고 있다. "
1361,바리오미터 (Variometer),2개의 코일을 직렬로 접속하고 그 한쪽을 다른쪽의 내부에서 자유로이 회전할 수 있게 하여 결합도를 변경시킴으로 해서 합성 인덕턴스를 연속적으로 바꿀 수 있게 한 장치
1362,바스켓 (Basket),재생식 공기예열기에서 가열소자(Heating Element)를 넣는 케이스이다.
1363,"바스톡형밸브 (바스톡型밸브, Bar Stock Type Valve)",봉강으로 만들어진 밸브 몸통을 말한다.
1364,바운싱 (Bouncing),접점이 닫히고 열릴 때 수반되는 현상으로 접점이 닫힐 때 한번에 완전히 닫히면 그만이지만 개폐를 되풀이하는 현상이 생긴다. 접점이 닫힌 직후 국부적인 접속부의 진동에 의해서 비교적 짧은 주기로 개폐를 반복하는 것을 차터링이라 하고 이에 반하여 비교적 긴 주기로 개폐를 반복하는 것을 바운싱이라 한다.
1365,바이메탈 (Bimetal),열팽창 계수가 서로 다른 두개의 금속판을 용착 또는 납땜한 것으로 온도가 높아지면 한쪽면이 다른쪽 보다 더 늘어나서 굴곡이 생기므로 그 끝에 접점을 만들어 전기회로의 개폐 등에 이용한다.
1366,바이스 (Vice),"손다듬질, 조립작업 기타의 가공작업때 공작물을 고정시키는 공구이다."
1367,"바이어스/편중 (偏重, Bias)",1.통계 : 평균오차가 0이 아닌 불균형을 이루는 오차의 영역이다. 2.전장 : 어떤 회로나 장치의 동작 또는 그 특성을 조정하는 목적으로 회로소자에 가해지는 전압이나 전류이다.
1368,바이오가스 (Biogas),생물 반응(미생물 발효나 효소 등의 이용)에 의해 생성되는 연료용 가스를 총칭하여 바이오가스라 한다. 주요한 것으로는 메탄과 수소가 있다.
1369,바이오가스(Biogas),"혐기적 소화작용에 의해 바이오매스에서 생성되는 메탄과 이산화탄소의 혼합형태인 기체. 이러한 혼합기체로부터 분리된 메탄을 바이오 메탄가스라고 한다. 그외 바이오 가스의 형태는 퇴비가스, 습지가스, 폐기물 등으로부터 자연적으로 생성되는 것과 제조된 가스도 있다."
1370,"바이오가스발전 (바이오가스發電, Biogas Power Generation)","바이오가스 발전은 태양광으로 합성되는 유기물을 가스화하고 연소시켜 전기로 변환시키는 기술이다. 유기물을 가스화하여 발전하는 기술은 두가지로 나눌 수 있다. 첫째는 나무, 건초, 농산물의 줄기를 비롯한 목질계 바이오매스를 건류하거나 열적 또는 촉매를 이용하여 가스화하고 이를 연소시켜 가스 엔진이나 터빈을 돌려 열과 전기를 얻는 바이오매스 가스화 발전과, 다른 하나는 물을 많이 함유한 유기물이 혐기 상태(산소가 공급되지 않는 상태)에서 발효되어 발생하는 메탄가스를 이용하는 발전 방식이다. 이 방식은 종래에는 유기물 농도가 높은 축산 분뇨 폐수, 전분질 폐수 등을 혐기 소화 처리할 때 발생하는 메탄가스를 이용하여 발전하는 것에 국한되었으나, 최근에는 유기성 고형 폐기물(음식 쓰레기 등)을 반응기 안에서 혐기 소화시킬 때 나오는 가스를 이용하거나(바이오가스 발전) 이를 매립하였을 때 발생하는 농도 50∼70%의 메탄가스를 이용하는(매립지 가스 발전)방식도 보편화되고 있다."
1371,"바이오디젤(Biodiesel,BD)","폐식용유나 쌀겨 등 식물성 오일을 알코올에 반응시켜 만든 순도 97% 이상의 메틸에스테르라는 물질로, 분자 내 산소를 포함하고 있는 친환경 제품이다. 그리고 대체에너지촉진법상 대체에너지로 인정돼 면세해택을 받고 있다. 바이오디젤은 바이오 디젤의 혼합 정도에 따라 BD5(5% 혼합), BD20(20% 혼합), BD30(30% 혼합), BD100(순 바이오 디젤)로 제품이 나뉘어진다."
1372,바이오매스 자원(Biomass Resources),"에너지원 또는 화학공업용으로서 이용될 수 있는 일정규모로 집적한 생물체를 말한다. 목재와 같이 태워서 연료로 하는 것, 수액처럼 분해하여 석유의 형태로 이용하는 것, 혹은 식물중의 전분처럼 발효시켜 알콜화하여 사용하는 것이 있다. 농축산폐기물이나 도시쓰레기 등의 미이용 자원도 포함된다."
1373,바이오매스(Biomass),"바이오매스란 원래 ""생물량""이라는 생태학적 용어였으나 현재는 에너지화할 수 있는 생물체량이란 의미로 사용되고 있음. 녹색식물은 태양에너지를 받아 물과 탄산가스를 이용하여 전분, 당 또는 섬유소를 합성하고 이를 식물에 저장함. 동물은 식물을 먹고 자라며 동식물은 미생물에 의하여 종국적으로 탄산가스와 물 등의 무기물로 분해되어 하나의 순환과정을 형성한다.이러한 생태계의 순환과정 중에 관련된 모든 ""유기체""를 일컬어 바이오매스라 하며 이중에서 가장 많은 것이 식물 자원임. 이러한 바이오매스로부터 여러 가지 형태의 에너지를 얻을 수 있으며 이 에너지는 ""재생성(renewability)""을 가지고 있다고 말함. 그 재생속도는 생물체마다 각기 다르며, 또한 계절 또는 하루를 주기로하는 태양광의 조사량, 기후 그리고 날씨조건 등에 따라서 다르다. 각 식물의 성장주기에 따라서도 다르며, 생물체의 지배조건에 따라서 크게 달라짐. 그러나 통계학적으로는 재생속도를 평균 1년을 주기로 한다고 보면 됨. "
1374,바이오매스변환 (바이오매스變換),"지구상의 생물권(生物圈)에는 동식물의 유체(遺體)를 미생물이 분해하여 무기물(無機物)로 환원시킨다는 물질순환 사이클이 있는데, 이 미생물(분해자)을 대신하여 인간이 이것을 에너지나 유기원료로 이용하는 방안이 있다. 마른잎이나 짚으로 밥을 짓거나 장작불로 증기기관차나 자동차를 굴리고 횃불로 어둠을 밝히는 것 등은 바이오매스의 직접적인 이용이며, 목재를 구워 숯을 만들고 미생물을 사용하여 알코올을 만들거나 메탄가스를 발생시키고 풀이나 짚을 썩혀 퇴비를 만드는 일 등은 바이오매스의 변환이용이다."
1375,"바이오매스액화(Biomass-to-Liquid,BTL)",나무칩(Wood Chips)등 바이오 매스(Bio-Mass)를 원료로 생산된 합성액체연료. 이 공법을 BTL이라 함.
1376,바이오매스에너지 (Biomass Energy),"태양에너지를 받은 식물과 미생물의 광합성에 의해 생성되는 식물체, 균체와 이를 먹고 살아가는 동물체를 포함하는 생물 유기체를 일컫는다. 따라서 바이오매스 자원은 곡물, 감자류를 포함한 전분질계의 자원과 초본, 임목과 볏짚, 왕겨와 같은 농수산물을 포함하는 셀룰로오스계의 자원과 사탕수수, 사탕무와 같은 당질계의 자원은 물론 가축의 분뇨, 사체와 미생물의 균체를 포함하는 단백질계의 자원까지를 포함하는 다양한 성상을 지니며 이들 자원에서 파생되는 종이, 음식찌꺼기 등의 유기성폐기물도 포함한다."
1377,바이오에너지 (Bio Energy),"태양광을 이용하여 광합성 되는 유기물(주로 식물체) 및 동 유기물을 소비하여 생성되는 모든 생물 유기체(바이오매스)의 에너지를 바이오에너지라 한다. 바이오에너지 생산기술이란 생물 유기체를 각종 가스, 액체 혹은 고형연료로 변환하거나 이를 연소하여 열, 증기 혹은 전기를 생산하는데 응용되는 화학, 생물, 연소공학 등을 말한다."
